"username","rating","helpful","total","date","title","review"
"robertmfreeman","8","151","188","17 September 2007"," A fun, silly movie. What's everyone whining about?
","What are people whining about? Balls of Fury was quite funny! A few years ago, the people who are now trashing this movie would have been going gaga and adding a 100 million to its gross revenue...but that's part of the problem. Tastes have changed.<br/><br/>I'm going to go on the record as saying that this movie is at least as funny as anything Adam Sandler or Will Ferrel has ever made. Why is it doing worse then? People just don't want silly, stupid comedies anymore, which is why Superbad is doing much better instead.<br/><br/>Balls of Fury is a very funny movie with a wonderful cast (especially Christopher Walken and Thomas Lennon), and if some of the jokes fall flat, or gave themselves away in the trailer, the movie moves quickly enough that it doesn't matter. They're already onto another joke.<br/><br/>Times have changed, and unfortunately for the movie, so have tastes. These days, even silly spoofs are expected to meet a required level of maturity, and for those that were raised on Naked Gun, Hot Shots and Police Academy movies, that's a little sad.<br/><br/>Go ahead, say the movie is juvenile. Say it's stupid. Just don't say it isn't funny. There were at least three moments during the movie when the entire theater was rolling in the aisles. I've never seen a SNL alumni movie do that."
"drkvas","6","99","131","10 September 2007"," All depends what you are looking for
","This movie is by no means garbage as some have posted, nor is it a great movie. Think before you buy the ticket. If you walk in expecting a spoof about ping pong w/ a cast of completely 1 dimensional characters to be a 10/10 you must live a life full of disappointment. This movie is funny, and if you didn't find yourself laughing at it you are probably already dead or on the fast track to ulcers and a stress induced stroke by age 30. This is not the first movie that approached a ridiculous subject in such silly manner. Odds are if you hate movies that have done that in the past (ie: Dude, Where's My Car, Blades of Glory, Hot Rod, etc.) you are gonna hate this one as well. As it stands right now this movie has a 4.6 and that probably a little low due to people 1 staring it because they wanted the Saving Private Ryan of ping pong movies. This movie should probably get a rating in the 6.1-6.3 category. If you have a little time to kill, have already seen Super Bad, and want a good laugh go check it out. Otherwise wait till it comes out on DVD or just ignore it. As for those who have blasted it. Go blast a movie that actually supposed to be good and isn't as opposed to picking on the 90 lb. asthmatic kid of movies. This movie can't defend itself for being stupid because is supposed to be. If you couldn't tell that from the trailer, then odds are you haven't made it this far into my comment."
"Crazy Ian","7","97","130","12 September 2007"," I liked it, I don't understand other people's problems with it...
","I laughed at this movie. I laughed a LOT. True, some of the laughs were simply because some people were in this movie that had NO BUSINESS being in it, because they are considered to belong to a higher echelon of movies. Christopher Walken and Maggie Q are usually seen in LARGE blockbusters or high-profile indies; George Lopez has a very successful TV series, not to mention MANY cameos from well-known comedic actors. These people are GOOD. When they are on the screen, funny stuff happens. The script is an obvious parody on the movie ""Enter The Dragon"", but with ping-pong in lieu of kung-fu or karate. It also spoofs the ""underdog"" motif like the ""Rocky"" movies. I dunno, all I can say is that I REALLY enjoyed this movie. I didn't expect much, and I got a lot back because of that. True, I was a little liquored up, and a second sober viewing might not pay off repeat dividends, but I had a good time. Isn't that really what it's all about? Honestly, it ain't Citizen Kane, but I've seen crappier movies... a contemporary comparison: I was NOT disappointed by this movie, and comparatively much more disappointed with the 3rd Pirates of the Caribbean movie...<br/><br/>Yaaarrrr, thar be worse things under the sun, matey..."
"doolittle1","6","35","45","24 September 2007"," Not as bad as I expected
","I went into the theater expecting almost nothing good coming out of it. I read the reviews- Washington Post, USA Today, Rotten Tomatoes, etc. I knew they were horrible and quite honestly, I thought I would hate the movie. But my friend wanted to go, and me having no life whatsoever, I agreed to join her.<br/><br/>I have to say, I should go into to more movies with such low expectations, because I really enjoyed it. Was the acting superior? No. Was the script well-written? No. But it was funny and Christopher Walken makes all things glorious, so all in all, it wasn't a bad way to spend a Thursday night after an especially terrible day of work. The actors all seemed to realize that they weren't participating in a project that would make movie history and they all seemed OK with that. It was very much a movie done to simply enjoy the play on the word ""balls"" and in this particular case, it was forgivable.<br/><br/>Overall, don't go in expecting complete comedic genius and you just might find yourself laughing."
"mollymormonbrat","5","71","101","15 September 2007"," Not the greatest ""stupid movie"" made, but it certainly made me giggle.
","This has to be, quite possibly, the dumbest movie I have seen in a very, very long time.<br/><br/>However, that is not necessarily a bad thing. I don't think there was a single moment in this film that purposely wanted any smidgen of intelligence whatsoever.<br/><br/>And, heck, the reason I went to see this movie was because I thought it looked funny. And, guess what? I laughed. I don't know if this will go into the treasury of greatest stupid movies ever made, but it did leave me with a smile on my face.<br/><br/>I think it was because it was ping-pong. Yes, I like a good game of ping-pong as much as the next person, but come on. It's ping-pong. Just try telling that to these characters. The fact that anyone could take so slight a game so seriously cracked me up.<br/><br/>And that's where this movie works.<br/><br/>It's pointless, silly, and down-right brain cell killing. But I found myself forgiving everyone because they were so good-hearted in waltzing around with their idiotic humor.<br/><br/>No, it will probably not be nominated for Best Picture. But as for dumb comedy goes, this nicely held its own."
"FatMan-QaTFM","8","34","46","16 December 2007"," Mocked its own genre, not for everybody
","This is a Thomas Lennon written comedy, so you know it's going to be a little abstract, and very pacing based. Balls of Fury really did a great job of keeping in the same humor vein of Reno 911, etc.<br/><br/>Yes, there are crotch shots and other typical middle school humor, but they happened so often and with such randomness that it went from stupid to hilarious.<br/><br/>A lot of the humor is based in uncomfortable moments. Not a lot of people enjoy being made uncomfortable by something they are viewing for entertainment, but if you like that style of humor, Balls of Fury is right up your alley.<br/><br/>This isn't for everybody, so it'll either be a 10 or 1 for you. Worth the rental just to see."
"helmutty","6","21","28","30 September 2007"," Balls of fury!
","It is not that bad. I am one of the guys who like this. It is not bad comparing to the movies that were recently released in Singapore. Underdog is not very good, can't even be a superhero movie. Shoot em' up is for hard-core action fans and basically is very violent and bloody. Then it is Balls of fury which I enjoyed watching. I thought it was something like Prince of tennis, the live-action movie and the ping-pong ball fights scenes are something like that. That, the ping-pong ball fights, is the thing that attracted me to watch it. But Prince of tennis is better than this. Balls of fury got the comedy and the simple action which becomes a harmless fun movie. I like movies as long as they are fun or entertaining. Balls of fury, though fun, is considered quite dumb for some mature adults or teenagers, the director used stupid jokes like always get hit in the groin and banging into the wall. It has to be stupid to be funny. Sometimes, I admit that it is quite dumb in some of the scenes but it is fun, it got slow-motion ball fights, it got Maggie Q who is hot and it got dumb-a** jokes so what more you want for a dumb comedy.<br/><br/>Overall, it makes a harmless movie that you can watch in your free time. It can be funny sometime and it too can be dumb sometime. You may laugh or smile at some scenes. I don't know but I smiled when watching it even at the stupidest jokes. Best to leave your brains at home while watching. This movie is not to be taken seriously."
"unbrokenmetal","Null","5","5","26 August 2009"," Ping-Pong: second chance
","In a time when we are mostly given the sequel to a rip-off of a sequel to a blockbuster, I'm grateful for any movie that is slightly original, and I haven't seen any other movies yet about a Ping-Pong tournament to the death - have you? Even if some elements were familiar like the secret agents and Asian villains and although a couple of jokes fell flat, ""Balls of Fury"" has enough fresh ideas to offer to work well as a comedy. It helped that the hero was played by an unknown actor instead one of the usual comedy stars because he plays a nobody - somebody who once almost became a hero at the Olympics but lost. He doesn't deserve a second chance but gets one, anyway - encouraged by his coach with words of wisdom like ""believe in yourself when nobody else does... like now""! Maggie Q as his training partner is hot, and Chris Walken as Feng adds the eccentric element which fits the colorful scenery. I liked it."
"PWNYCNY","9","27","39","14 September 2007"," Laughter abounds
","There are some who may look down at this movie with disdain and dismiss it as just another lowbrow attempt to elicit cheap laughs. Well guess what? This movie does exactly that, and that's great! This is an incredibly funny movie, with goofy but likable characters, especially James Hong who plays Master Wong. James Hong gives one of the funniest performances ever. He was great. He made this movie happen. Also, Maggie Q was great. She is the next Sandra Oh. And the the goofy story line also contributes to the overall humor, and of course, one would be remiss if they did not mention the performance of Christopher Walken who once again proves that he is a great actor. His deadpan approach was absolutely perfect for this movie. If you want to watch a movie that will make you laugh, then this is the movie for you."
"alan-1011","4","61","105","29 August 2007"," Okay, for cable
","Balls of Fury wasn't the total disaster, but when that's the highest praise I can offer, well, that's a problem. Think of it as a lesser version of Dodgeball.<br/><br/>Ping-pong just isn't that funny, or exciting, or anything really - just like the film. The idea of underground ping-pong never really goes anywhere. The jokes are okay at times, but there are no big laughs and certainly no surprises.<br/><br/>Unless you are a 10-14 year-old boy, who given the film's humor and scantily clad actresses is obviously the target market, you will probably be disappointed by paying money for it. Wait a couple of years and watch it free some night on Comedy Central and spend your ten bucks somewhere else."
"TheMovieMark","5","104","201","30 August 2007"," The jokes suffer from the ""Kate Moss, Heather Mills McCartney, and post-2000 Muhammad Ali Syndrome.""
","Taxi. The Pacifier. Herbie Fully Loaded. Let's Go to Prison. Night at the Museum. If this list of movies is an accurate representation of your DVD collection, then my friends, you either have a young child in the house or a strange fetish for average-to-below average comedies. Or ""absolutely dreadful"" in the case of Jimmy Fallon's Taxi. *shudders* I'm still trying to erase memories of that steamer from my mind.<br/><br/>Other than being part of the aforementioned pathetically sad DVD collection, do you know what else each of these movies has in common? They're all written by Ben Garant and Thomas Lennon, the duo who wrote, produced, and directed Balls of Fury. Are you trying to decide whether or not this is a film worthy of your time and money? Please let my above revelation stand as ""enough said."" <br/><br/>In all honesty, what can you expect when you take a poor man's Jack Black and give him the starring role in a poor man's Dodgeball? A little thing I like to refer to as ""not much."" Dan Fogler gives it the ol' college try, but perhaps the material is to blame for his mostly forgettable performance. He delivers a couple of laugh-out-loud moments, but by the time he's lip-synching to Def Leppard you'll be asking yourself, ""So who's this guy, and why is he doing a bad karaoke impersonation of 'Jack Black Meets Sam Kinison'?"" <br/><br/>I will give Balls of Fury three credits - 1) Maggie Q is adorable, 2) The film rightfully never takes itself too seriously, and 3) It's nowhere near as filthy as I expected. At the top of my notebook I wrote, ""Balls/Genitalia References"" and I was set to keep track. I just knew they were going to fly off the screen fast and furious, especially judging by the ""a huge comedy with tiny balls"" tagline. So I was quite shocked when the grand total was only one, and that one was merely Maggie Q's character disgustedly relaying an example of the comments she was forced to deal with from male players.<br/><br/>What more can I say about a film whose crowning achievement is, ""Well, I didn't expect much, and it wasn't the worst movie I've ever seen, so whatever""? That certainly doesn't send you rushing to purchase a ticket, now does it? It'll be on TNT or TBS soon enough so just have patience and watch a few legitimately good comedies in the interim. There'll come a time when you're flipping channels, nothing else is on, and you'll cruise across this. You can decide then whether you want to sit through all of it. The end result will likely be a long email thanking me for saving you $8.<br/><br/>Before I commence, let me once again bring attention to my above ""poor man's Dodgeball"" quote. I overheard several disappointed people say, ""I thought it'd be like Dodgeball."" What's that? Yeah, they said it in unison, Wisenheimer. Now shut up. The consensus? It's not even close. So if that was the opinion you formed after watching the trailer then dismiss that notion immediately. It's an interesting concept that probably contains about ten minutes of solid comedic material.<br/><br/>What ultimately happens when you stretch that over an hour and a half? Unfortunately, the jokes suffer from what I like to call the ""Kate Moss, Heather Mills McCartney, and post-2000 Muhammad Ali Syndrome."" In other words, they're flat, lame, and they pack no punch. Let's see them put THAT on the DVD cover."
"oakstreetkeeley","10","36","67","29 August 2007"," Nice Balls
","""Balls of Fury"" may be conventional, but there is a natural, fresh comedy about Fogler. With long, thick curly hair, pointy mutton chops and portly body, he has the look of someone who accidentally wandered onto a movie set, shrugged, and decided to play along. He plays Randy Daytona, a star in the underground world of table tennis competition has seen his fame decrease and luck turn sour. He attempts to recapture his former glory but is soon confronted by the FBI and asked to go undercover to smoke out a notorious criminal and ping-pong lord called Feng. He teams up with a blind ping-pong sage and Maggie Wong to complete his secret mission. the film is perfect for Naked Gun fans and Dodgeball fans."
"shaolinlooper","10","17","29","30 August 2007"," well done, funny, especially if you play TT or speak Chinese
","I enjoyed this movie a lot. It was neither Die Hard action or Three Stooges slapstick. There is a lot of subtle humor in the style of Reno 911. I am a serious table tennis player and recognized a lot of inside jokes about the lack of respect our sport gets and the characters who show up to tournaments. There was lots of funny material in the Chinese language also. I thought Dan Fogler, Maggie Q, Tom Lennon, and Jason Scott Lee were excellent. The ""Dragon"" stole the show for me. At the US Nationals, there are several amazing ""dragons"" every year playing spectacularly. Table tennis is really a great and difficult sport. You have to master equipment, speed and spin, pressure points, and even the occasional cheater. But everyone who tries the sport or comes back to it in later years, finds it addictive. It is like catnip for humans. I think many serious players fear that this movie might set our sport back or make it the butt of jokes, but I hope many will see this movie and give table tennis a try. Table tennis has been described as a mix of non-contact martial arts and chess and portions of this movie portrayed it as such. I don't think it would be suitable for young children, but teenagers won't be traumatized. Also stay for the credits, which introduce the cast and show bloopers."
"bopdog","7","24","44","30 August 2007"," Chuckle Out Loud. Quiet humour. No belly laughs, but lots of long and slow comedy, done fairly well.
","This definitely comes under the heading of ""Stoopid Comedies,"" which I happen to really enjoy. But the jokes are more wit than belly laughs. There isn't much outright slapstick--- which I would have liked. The funny parts are quiet, although not particularly subtle. The humour is more from the mild delight of seeing some old-time character actors like James Hong and Christopher Walken play out some long and slow bits over the course of the movie. Some of the humour also comes from a bit of satire--- although not of the outright ""spoof"" category. Mostly, it's just a series of improbable and goofy scenarios--- silly, whimsical, and with enough colour and dash to be enjoyable. If you want laugh out loud comedy--- you'll be disappointed, although I, and the audience, chuckled out loud. If you want a pleasant enough folly, then you'll probably be satisfied."
"ccthemovieman-1","8","17","30","22 December 2007"," Wong As 'Hong' A Surprise In This Pong Farce
","If you like ping pong, laugh at the insane characters Christopher Walken likes to play, enjoy dark comedy, don't mind a bunch of stupid-but-funny scenes and a wildly outlandish story....you should like this movie. I did, and I realize it is a dumb movie....but it's fun and it's entertaining. <br/><br/>In many respects, this is a typical farcical comedy of today, with the same ingredients you see in many of them - the same type of outrageous characters (everyone in here), the typical spy story and Nazi villain (will Hollywood move on, in that regard?), tons of sexual innuendos and scantily-clad babes, an ugly-and fat-male lead and total absurd humor. It's the latter that I like, and I can't recall how many times I laughed out loud at some ridiculous sight or sentence that I saw in here.<br/><br/>Walken, even though he doesn't play the lead guy is fascinating, as always in his typical off- the-wall role. To me, though, James Hong, an actor in his late '70s, just about stole this film as ""Master Wong,"" the blind instructor. He was flat-out hilarious and had a lot of great lines. Of course, so did Walken and the film's star, Dan Fogler (""Randy Daytona""). and the villain Thomas Lennon as ""Karl Wolfschtagg."" Kudos to Lennon for also co-writing the script.<br/><br/>Other reviewers here who wrote ""silly but entertaining"" hit it right on the nose. That's what it is, and that's what you should expect. Humor-wise, it is another ""Dodgeball,"" except now it's ping-pong, and it's funnier.<br/><br/>In addition, you get profound words to live by, such as ""To die like a tiger is better than living like a pussy."" Hmmmm."
"tajoholic","Null","15","26","16 September 2007"," Silly but entertaining
","Not the greatest comedy of the summer, but it had its fair share of laughs. Some of the situations were pretty amusing and some of the lines were laugh-out-loud funny.<br/><br/>Christopher Walken seems to always make the best out of his roles, whatever he's given, he makes it his own. And this is no exception. The script wasn't rolling on the floor funny, but it had its moments. This would qualify as a good choice for a matinée-priced movie, I'd say.<br/><br/>As an aside, I don't know WHY ON EARTH that African American lady who played Christopher Walken's female henchman keeps getting roles (she played Jennifer Love Hewitt's antique shop partner for a while and stunk in that role too)."
"moviemaniac008","7","19","35","29 August 2007"," Balls of Fury is Hilarious!
","I got a chance to see Balls of Fury in a premiere. It is hilarious! Let's start with the main actors: Of all of the main characters, I found Master Wong(James Hong) and Mr. Feng(Christopher Walken) really convincing. The others, such as Dan Fogler(Randy Detona), Maggie Q(Maggie Wong) and George Lopez(Ernie Rodriguez) were also convincing. The story seems like crap when you first read the synopsis, but believe me, it's actually Ping-Pong that makes us laugh for a whole hour and a half. If you saw it, and you liked it and you're actually reading this review, then you must know what I'm talking about. I highly recommend this film.<br/><br/>Why? Because it is unique. It's the kind of film that you might want to see over and over again, and, despite it's stupidity, will still like it"
"tyler-114","10","18","34","31 August 2007"," Awesome movie
","Seems that a lot of people are writing reviews and judging this movie pretty harshly. Movies are used by many as a form of escapism, I think this movie did an excellent job of this. It was a silly movie that was enjoyable to a broad audience especially if you like table tennis. I think Dan Fogler did a decent job and Christopher Walken's character was interesting. George Lopez was also way better then i expected he did a decent job. Anyone that takes their movie watching seriously enough to not find the male sex slaves, or panda humor funny i pity you. This should be getting a much higher rating then most are giving it."
