"username","rating","helpful","total","date","title","review"
"splat99","8","74","88","22 May 2003"," Gritty and Powerful
","I have seen ""Bloody Sunday"" twice now - once on the big screen and once on DVD - and read Don Mullen's book, ""Eyewitness Bloody Sunday.""  This movie is a very realistic depiction of the defining moment of the ""troubles"" in Northern Ireland.  The hand-held cameras and grainy film style make it feel more like a documentary than a movie, which of course is the intent.  As another reviewer has mentioned, the acting is very natural throughout.  It does take some time to get started, but once the the shooting starts it hits the viewer like a sledgehammer.  Very powerful.<br/><br/>     The film jumps so frequently from scene to scene that at times it is distracting, though I was much less annoyed by this the second time around. And, having seen it once with and once without subtitles, I must say that although the subtitles (optional on the DVD) are intrusive they are quite welcome.  I love the Irish accent but at times it can be difficult for me to decipher,and much of the dialogue in the movie is muted.  It was good to know what was being said.  <br/><br/>    As for the objectivity, of course the movie is slanted - so was the situation.  But it is not unreasonably slanted.  The British are not shown as one-dimensional demons - in particular, Nicholas Farrell does a great job of conveying Brigadier Mclellan's ambiguity and even disapproval of the course taken against his wishes by the supposed ""Observer,"" Maj. Gen. Ford (who, if the movie has a villain, is the prime candidate.)  At one point early on several Paras are discussing the day's prospects, and reveal how tired they are of being harassed, shot at and otherwise abused by the native population.  This makes the day's events more understandable.  This does not EXCUSE the cold-blooded gunning down of 27 people - there is no excuse for that - but at least one can see a contributing factor.  And protesters are shown, once or twice, firing back.  (The key here is firing BACK - evidence indicates that no marchers fired until the first two protesters were wounded.  And those scattered few that attempted return fire were quickly dissuaded by their countrymen.  Later in the day the IRA did go into action, but not until after the bloodletting in Bogside was over with.)  Ivan Cooper's (James Nesbitt) words at the close of the film were shown to be all too true in the years since the actual incident.  The IRA was on unsteady legs at the time, but has never lacked support since January 30, 1972.<br/><br/>     The film is a powerful object lesson concerning the misuse of force, and one that governments everywhere - including my own country, the United States - should take to heart.  It has a few flaws, but I think deserves the awards it has received.  8/10 points."
"mariobc","10","46","54","3 September 2006"," A very realistic portrayal of the events in Londonderry 1972.
","I saw this film about 2 years ago, and was extremely impressed with the realism of the film.Having served with the British Army in Northern Ireland many years later I found the atmosphere and the general appearance and manner of the Paras extremely accurate, as I have seen many films about Ireland when trying to portray British soldiers they unfortunately could of done a little better. I consider myself to be open minded and understood and sympathized with the local catholic population during these events as this is or was pretty much how things are with regards to the catholic population in Northern Ireland.For me, the main good points were that the film was made in a documentary style in which the facts were shown in a straight to the point manner without any fancy computer effects or handsome faces portraying the main players. well done to the production team !!!!"
"noralee","Null","55","72","30 November 2002"," One day of ""the troubles"" packs a universal wallop.
","""Bloody Sunday"" is a very startling, cinema-verite recreation of a very specific date (January 30, 1972), in a very specific place (Derry, Northern Ireland) of an event that for the Irish became ""our Sharpeville.""<br/><br/>
But for an American audience with no benefit of subtitles for the brogues and working class Brit accents, no explanations outside of eventual context for lingo and slang (it took me awhile to keep track of ""provos"" vs ""paras""), the quasi-documentary, in-your-face approach takes on a tragic universality.<br/><br/>It could be part of a Cassandra trilogy with `Black Hawk Down' and `No Man's Land' about why military should not be in charge in urban strife, whether as ""peacekeepers"" or in civil wars or regime changes, no matter how heinous the regime to be changed.  A lesson for the Baghdad invasion planners?<br/><br/>
Cities are complicated social ecologies, and the film shows a great diversity of attitudes and pressures on all sides, managing to be both clinical in meticulous detail and visceral in shocking impact.  The film is probably not objective about the British (I don't think it's a coincidence that the imperious Brit ""observer"" who takes repugnant charge is played by Tim Pigott-Smith who was a similar colonialist in `The Jewel in the Crown."") A central universal image becomes the awesome power of rock-throwing, unemployed teen-age boys to spark war.<br/><br/>The liberals in the middle, clinging to dreams of Gandhi, Martin Luther King, and fair community relations, are morally destroyed over the course of a few hours and the extremists with guns on both sides feed on each other in perpetual destruction like the ouroboros image of the snake eating itself. I kept feeling I missed the exact flash point in a wandering attention moment and wanted to immediately re-watch it to see if I could track the gotcha! moment when escalation could have been prevented, so I look forward to this being available on video tape.<br/><br/>But the film does clearly show that it was attitudes that created the violent outcome and consequent government non-investigation, as we see in so many police situations.  Once soldiers enter a city it is a police situation with all those complexities.<br/><br/>I know James Nesbitt primarily from frothy Irish comedies, like `BallykissAngel,' so his staggering portrayal of the M.P. in the middle is a revelation, as he goes from planning a civil rights march to pleading with his girlfriend to physical heroism to a break-down in shock.<br/><br/>
The version of the titular U2 song played out at the end, running well past the credits finish, is a moving, live, passionate audience sing-along where Bono shouts out other locales that have experienced similar situations to emphasize the universality."
"ainge_devyr","10","31","40","12 June 2006"," for anyone even peripherally familiar with the northern conflict, this is an important film.
","being from belfast, i have an all too familiar recollection of this and many other tragic events.<br/><br/>being born protestant, i have little use for the cowardly, yet brutal and malicious, mutation of the provisional ira; under the helm of gerry addams.<br/><br/>being born sentient, i have little use for the fire and brimstone polarisations; counterspin and half-truths of ian paisley.<br/><br/>being born human, i have empathy for the slain.<br/><br/>the bloody Sunday massacre in derry, was a tragic testament to man's blood-lust, fueled by fear and adrenaline. the events depicted in the movie ""bloody Sunday,"" provide an arresting portrayal of a tacitly monumental aspect of modern ulster history. the portrayals of the people and the events maintain an objective testimony toward a tragedy that is both sobering and inexcusable.<br/><br/>""bloody Sunday"" takes no sides, and distributes no blame. it simply reenacts the events as they were recorded, and lets the viewer make his or her own decisions.<br/><br/>if you are familiar with the conflict; if you are distressed by man's inhumanity unto himself; if you are simply interested in a detached account of history; this is an important film to see."
"comprachio","10","28","36","22 January 2002"," Not a farse
","Naive or not, the film version of Bloody Sunday couldn't do anything else but show the pandemoneum and confusion of a massacre of many innocent people.  This confusion was shown on both sides.  An army of young men being thrown into a situation which they didn't understand.  A people of a City riddled with gerrymandering and oppression.<br/><br/>The film showed stones being answered by guns and gas. As a British citizen I was moved and shocked.  The film brought to life the many books i've read on the subject.  It didn't point blame.  It was never shown in the film who fired first but it showed that both sides fired.  It documented how 13 people protesting for civil rights (majority of them children) were gunned down in cold blood by a 'peace keeping' security force.  The bodies are the evidence, their memory is the legacy.<br/><br/>This film highlights the importance of sensitivity when approaching the dark days of our history.  It succeeds where so many films fail by showing that no good can come from such events.  A sterling performance from James Nesbitt shows that he is a versatile actor not afraid of approaching difficult and controversial roles.  Perhaps we should forget the bickering and respect this for what it is; a stylistically impressive and well acted movie."
"toddgold-21945","10","6","6","7 November 2018"," Breathtakingly conveyed
","Obviously an important day in history, and the events of that day are breathtakingly conveyed by the best Docudrama filmmaker we have, Paul Greengrass, Before we Knew who he was-and that may have made a certain difference in my experience of the film-it was more exhilarating (and impressive) before Greengrass had made a name for himself at this kind of documentary-styled filmmaking. This one, when it came out, definitely gave me goosebumps....todd gold"
"ickabod147","9","49","75","25 November 2002"," Fact or Fiction? Who can tell...
","'Bloody Sunday' is, if nothing else, a very powerful film and,<br/><br/>depending on which side you're on ideologically, can move you to<br/><br/>tears or incite you with rage.  Is this film an accurate depiction of<br/><br/>the days events?  I personally can't say for certain.  Having read<br/><br/>enough contemporary Irish history, including Don Mullan's<br/><br/>""Eyewitness Bloody Sunday"", I can say that both sides of the<br/><br/>conflict in Northern Ireland can conduct some very shady<br/><br/>operations and dealings when the moment suits them.  A lot of<br/><br/>people have asked ""Where was the IRA in this ""no-go zone"" that<br/><br/>they controlled?"" Well according to the book they had been asked<br/><br/>by NICRA (Northern Ireland Civil Rights Association) to remain at<br/><br/>the Creggan Estate.  Cooper and the rest of NICRA knew that the<br/><br/>march was banned and they didn't need the Provos to cause<br/><br/>anymore trouble.  Also, at that point the Provos were at a nadir of<br/><br/>sorts in terms of numbers and support.  There was a lot of hope<br/><br/>placed in the Civil Rights movement, and Bloody Sunday crushed<br/><br/>all chances of it really succeeding. The operation conducted by 1<br/><br/>Para was, I can only hope, a ""grab & snatch"" operation gone<br/><br/>terribly, terribly wrong.  <br/><br/>I can only surmise that out of the some 10,000 people in the<br/><br/>march (not a few hundred as listed in other reviews) some were<br/><br/>either in the IRA if not most definitely IRA sympathisers.  Do I<br/><br/>believe most of the marchers that were killed to be innocent<br/><br/>civilians? Yes.  Should the ""young hooligans"" have thrown stones<br/><br/>at the RUC & British Armed Forces? Probably not.  Did the IRA<br/><br/>shoot first or did 1 Para? I doubt that with all the confusion going<br/><br/>on, between CS gas & rubber bullets being fired anyone can tell<br/><br/>for certain.  I don't think that the Widgery Report was anywhere<br/><br/>near right, or the current Saville Inquiry will get it 100% right either.<br/><br/>But these opinions are coming from a remove of 30 years and a<br/><br/>pretty large ocean.<br/><br/>As for the film itself.  i liked it.  James Nesbit gave a career defining<br/><br/>performance as far as I'm concerned, going from the height of one<br/><br/>emotion to the absolute depths of another.  The Gerry Donaghy<br/><br/>character's accent was a little thick, to say the least.  However he<br/><br/>played a good victim with Republican feelings.  The jerky handheld<br/><br/>camera, which people either love or hate, worked well in this<br/><br/>movie.  It gave a real sense of being ""in the moment.""  Long story<br/><br/>short I'd give this film 3 1/2 stars out of 4."
"cottrellpj","9","22","31","27 October 2002"," Draining, But Worthwhile
","Normally I don't enjoy the handheld documentary style films, as they tend to induce waves of nausea, but Bloody Sunday had me riveted from the word go. That we already know how it's going to end is irrelevant, the pressure building on the day of the march is almost unbearable. Though there's been criticism that the film is slanted towards the republican point of view, I found it balanced, even in the depiction of the soldiers and officers. Everybody certainly looked the part and I went away feeling some sympathy for both sides. Given the close quarters and inflammatory nature of the conflict, it's amazing that bloodbaths like this (soldiers blasting civilians) haven't happened more often in Northern Ireland. It's only now, that retired soldiers have broken ranks and talked about what actually happened, that a film like this can see the light of day."
"Lomandal","10","4","4","12 January 2016"," A masterpiece not only to remember, but also to respect
","I've been getting overall information from IMDb for quite a while. Couple of days ago, I accidentally read a list called 'Best Irish movies'. By double checking, or triple checking or even more maybe, because I was too upset to count and I couldn't find this film, which made me terribly upset about till now. For those who haven't see this film, you need to see this film before you want to make any comment on Irish films. <br/><br/>Secondly, Paul Greengrass has set up a new standard of handy cam producing. I believe many late comers learned a lot from him. It's such a brilliant work. All these intense scenarios, conflicts and faces built in this film are not just impressive, I would say it's unforgettable. <br/><br/>Sometimes, people move on because life told them to. But sometimes, people cried and fought because no more they can hold on to. <br/><br/>This film, is definitely & absolutely the BEST Irish film, EVER."
"dawnofasgard","10","22","33","9 October 2005"," Great Movie
","A very well done movie. I found it to be a very factual and a very frank account of a terrible time in Irish/British history.<br/><br/>When compared to other books and materials I have read about the account in the past few years, I would have to say it was probably about as accurate as it could be. Of course we don't hear the exact language that was used, especially by British commanders during that time, but I think the movie gives a very likely occurrence of what happened behind closed doors. <br/><br/>Soldiers that were allowed to speak up, many years after the fact, have themselves, shed light onto what happened during that time."
"TedCrilley","Null","23","37","22 January 2002"," Documentary style drama recreating the events of 30th January1972 in Derry
","Although initially difficult to get into, Bloody Sunday proved worthwhile persevering, as the latter half puts the viewer in the carnage.<br/><br/> The acting, especially James Nesbit is excellent, the recreation of the mood is superb although it was obvious with the constant close ups that there was very little budget to recreate the scenery.  The geography was never explained and therefore would leave a viewer without prior knowledge of the area disorientated.<br/><br/> The documentary suffered from not being able to set the scene, a lot had happened in the week prior to the Civil Rights march that put both the participants and the security forces on edge and made the advance more significant.  The question of why the Paras were sent to Derry were never fully explored.<br/><br/> Overall it was flawless recreation of events from the point of view taken by the film makers on this particular incident.  It is worth noting that this is based on the Irish Governments review of the Widgery report into Bloody Sunday.  (NB the Widgery report is mostly considered by nationalists to be a white wash)"
"felixcat67","9","11","16","29 January 2008"," Phenomenal attention to detail is a big plus
","Certainly, anything dealing with ""The Troubles"" of Northern Ireland will quickly create a great divide between opposing viewpoints, and obviously 'Bloody Sunday' is no exception. For the record, I am no fan of the IRA. On the other hand I am no fan of sending an attacking force into a civil disturbance as police support. History is replete with evidence that this is simply a bad idea and will likely lead to an atrocity. For this I heap far more blame at the feet of British politicians who move their army around like chess pieces rather than at the feet of the army itself. And I believe Paul Greengrass handles this as such. Brigadier Maclellan is portrayed as a thoroughly professional soldier who is very conscientious about handling the march with minimal force yet finds this insurmountable upon the arrival of Major General Ford, who seems determined to have his Paras show those pesky Republicans who's boss. The Paras themselves are an elite attacking unit. They are trained to jump from planes and kill with maximum effect, not to make sure peace marchers remain peaceful. They don't want to be there any more than the Irish Catholics want them to be there. They're not policemen. They are frustrated and angry, but they are the ones with guns, Queen and country behind them. And when told to move in, they move in with a vengeance. Again, sending an assault force into a civil insurrection is just a bad idea. The inquest that followed may have been incomplete, but with all due respect to the Parachute Regiment in an unenviable situation, it was a massacre regardless of who fired first (and again Paul Greengrass does not take sides here and make it obvious where the first shot came from). There is a huge difference between understanding why something happened and attempting to justify it.<br/><br/>That said, Paul Greengrass's near pathological attention to detail ceases to amaze me after multiple viewings. Having long been a student of the army in Northern Ireland, there is no fault to be found in reference to the soldiers. The flak jackets worn beneath old pattern Para smocks, the mix of maroon berets and para helmets, the wood stocks of the rifles rather than the later plastic. Paul Greengrass apparently hired ex-servicemen who had done tours in Northern Ireland, thus eliminating the need to train the cinematic soldiers to look like real soldiers. They knew the lingo, they knew how to hold their weapons, they knew how to assault. In fact, Simon Mann, the actor who plays the Para commanding officer, was once in the British Special Air Service (SAS) until 1985, and in 2004 was arrested in Zimbabwe on charges of planning a coup in Equatorial Guinea. Many of the scenes are carbon copies of actual incidents seen in archival footage of the actual march. If you are familiar with such footage, you begin to forget you're watching a recreation. <br/><br/>It is a dark and cold film. It is gray and gritty. There is no dramatic score. The camera-work is often shaky. Dialogue is sometimes hard to understand. What is going on is sometimes confusing. And you know what? Life is like that sometimes, and that's what makes this film so powerful and brutally realistic."
"stensson","8","18","29","11 May 2003"," Like you were there
","This is a film with a terrible nerve, from the press conferences in the Sunday morning, through the preparations for the march and the preparations of the military, and forward to the scenes in the hospital afterwards. The camera is working in a way, there you definitely can feel the gloomy weather and the excitement.<br/><br/>It's also a 1972 feeling about it, which doesn't feel acted, but like  a documentary. James Nesbitt is making a tremendous job as the MP and when you notice that this man hasn't got an Oscar, the Oscar institution definitely seems like the stupid joke it is.<br/><br/>The only thing you can have against this Paul Greengrass' movie is the tendency in the end, where the relative documentary objectivity in the beginning, moves over to tendency. The unionists and the British government remain the totally bad guys and the catholics are the eternal martyrs. They might have been that this Sunday, but the conflict of Northern Ireland is a little more complicated.<br/><br/>However, this is definitely more exciting than most of what you see in the action genre."
"msayles_1980-1","10","11","17","28 December 2008"," powerful !! must see movie
","having been born in England and never truly understood or been taught the full story of Ireland and England's long lasting disputes -having been raised in Australia since i was 8 and born in the 80s,after this event occurred-i watched this film to gain a solid understanding of why i came from a town thats so heavily attacked by the I.R.A -Birmingham... what i felt when i finished this film shocked me ........ i am a huge horror fan ,so the idea of me crying as i watch a film is very rare -i think three films other than this one have succeeded in my 28yrs of life- but when i ended my viewing of ""bloody Sunday"", i was still wiping my eyes . it is a very powerful ,well recreated retelling of the Bloody Sunday massacre and James Nesbitt was absolutely astounding and his final speech brought me to tears as i wondered why this had to occur at all .....i say this film is a must see for everyone -just like films like Hotel Rwanda , American History X ,or This is England"
"rdoyle29","7","4","5","12 August 2017"," A good film almost done in by it's idiotic stylistic quirks
","Paul Greengrass directs this dramatization of the civil rights march that ended with British paratroopers killing 13 civilians, kicking off the long and bloody civil war that engulfed Northern Ireland for the next 30 years. Greengrass manages to do justice to the events despite his terrible visual style that involves an insanely shaky camera and hundreds of pointless jagged edits. This is largely chalked up to ""documentary realism"", but no documentarian would be happy with a film that consciously draws attention to it's own stylistic quirks and away from the events depicted in the film. James Nesbitt stars as Ivan Cooper, a politician who organized the march and bore witness to much of the slaughter. He does a magnificent job of depicting hope and optimism dying."
"DanH_99","5","27","54","24 October 2002"," Good movie. Bad documentary
","As many of the previous commenters have pointed out, this is a very exciting and well acted film about a shameful day in British history.  However, the documentary style film-making style means that factual omissions and implications have greater impact than in a film that doesnt purport to be 'historical fact'.<br/><br/>A couple of the previous comments have stated that Bloody Sunday was the start of the 'Armed Struggle'.  In fact, the hardline Provisional IRA split from the Official IRA in 1970, 2 years before Bloody Sunday - this was the start of the resumption of IRA military operations. 200 soldiers, policemen and civilians were murdered in 1970-1, so the soldiers would indeed have been scared about being shot, and would also have wanted to 'strike back'.  I didn't think that these motivations were portrayed in the film, and other than the historical omissions this is the only real weakness of the film which i would recommend to anyone irrespective of their own opinions on Northern Ireland."
