"username","rating","helpful","total","date","title","review"
"Jared_Andrews","7","16","17","15 December 2018"," Ryan Coogler's deft touch could have made this great
","The best moments of 'Rocky/Creed' movies are the ones that make you feel something. Creed II contains a few of those-perhaps not as many as you'd like but a few.
Adonis ""Donny"" Creed (Michael B. Jordan) and Bianca (Tessa Thompson) continue to share charming, effortless chemistry, leading to a few of those moving moments. Other moments come ringside when Donny and Rocky (Sylvester Stallone) exchange motivating words as the music swells, our pulses rise, and we slide to the edges of our seats. These moments are present in Creed II, but they don't pack the same punch as they have at their best, like in the first 'Creed' or 'Rocky.' There's something missing in the buildup and execution of these moments, and I suspect that that something is the delicate touch of director Ryan Coogler and the originality of first film in the series.
Being the seventh film in this franchise, Creed II faced an uphill battle in the originality department. By now, we all know the beats and how the story arch is likely to play out. But this story felt like it should have been the first and most obvious one pitched in the writer's room and one that should not have been the final choice. It's tricky to describe what I mean without mentioning spoilers, so suffice it to say that we've seen this story before, and we all could have seen it coming this time. The story is made of 99% recycled material, which is something I like in plastic and paper products but not in movies.
On top of the major issues with the plot, there are a few puzzling details, like why is Rocky so poor? He was the heavyweight champion of the world for nearly a decade, Philadelphia made a huge statue of him, and he is instantly recognized by adoring fans on a regular basis, yet for some reason, no one has any interest in his restaurant. Rocky, hire a manager! You could be raking in millions each year if you had someone helping you out.
Another issue, and this one seems more pressing, is the confusing struggle that Donny has to find his motivation for the fight against Viktor Drago. Drago is the top contender in the world, and Donny is the heavyweight champion of the world. Drago is talking mountains of trash. Drago's dad killed Donny's dad in the ring. Those are all great reasons for Donny to want to fight him. I don't see the struggle.
Fortunately, Michael B. Jordan is one of the most charismatic and energetic performers we currently have in Hollywood. His vivacity infuses the tired story with enough life to get by, and he absolutely pulls off all the training montages, even though he spends half his time doing neck curls, for some reason.
In the end, we have the fight everyone wants. It's satisfying enough despite the mixed message that it sends about not giving up but also knowing when to throw in the towel because you're dangerously injured and could literally die in the ring. We live in a world where we know the dangers of concussions in sports and the devastating long-term damage that they have on the lives of athletes. I find it hard to ignore, which makes these brutal fights a little bit tougher to watch, and it makes the victory celebrations a little less sweet because the only way to really win is to retire healthy."
"tomek-sulkowski","5","332","455","4 December 2018"," Protagonist has no arc and an emotional development of 9-year old. I was rooting for Drago in this one.
","Seriously, Adonis has shown nothing but how needy and insecure he is. I didn't buy his change at all and really couldn't feel what was he supposedly fighting for in that last fight. Yeah he had a kid in a meantime, but he remained the same selfish brat.<br/><br/>Both Dragos were FAR more interesting. Victor being this kinda confused brute, and Ivan having an actual arc: from using his son and manipulating him for any cost to gain back the approval of the wife and Russia, to accepting that it's the son who is important to him now, and spending time training (running scene) with him back in Ukraine by the end.<br/><br/>If this was a setup for Drago spin-off then kudos, I'm interested!<br/><br/>Watching the dilemmas of Adonis I caught myself rolling my eyes twice or thrice, and I'm not the rolling-eyes type. I seriously feel the need now to watch a GOOD fighting movie now to see if I haven't lost it and just stopped liking these, because I just don't get all the praises this movie gets."
"arabnikita","5","248","349","27 November 2018"," Weak all over
","Creed 2 (my personal 3 key points):<br/><br/>*A boxing movie with 10 minutes of boxing+training and 2 hours of talking and deciding things.<br/><br/>*Nearly a copy paste of Rocky 4 and if you thought that that fight was unrealistic, wait for this one.<br/><br/>*When Rocky was fighting in his movies even against a Russian I wholeheartedly wanted him to win because he came from nothing, struggled and had spirit. Adonis acts like boxing is his hobby, I just cant feel for him.<br/><br/>I cant say more without spoiling... But very weak overall"
"rishabhsinha2611","5","230","323","5 December 2018"," Dissapointment!
","Some poeple really liked it. But i guess i was expecting way too much from the film. The trailer was brilliant. And creed 1 was a much superior film. The film lacked soul. Everything seemed superficial and predicitable. Even the fight in the end was sort of a 10min montage. The Rocky series is known for its background scores, gritty action and is motivating. Creed is just a film without a backbone."
"slhaokippublic","1","106","149","16 February 2019"," Maybe the protagonists and antagonists should change places.
","Oh man.<br/><br/>We kind of expected it to follow a formulaic plot where the hero loses and then wins in the end. But what this movie does to fill out the in-betweens is so crammed full of cliches you couldn't fit in a fart even if you wanted to.<br/><br/>I actually rooted for the Drago father-son duo. Accidental? Not so much. We've a protagonist who is very unlikeable. Just because he's the lead doesn't mean we must like him automatically. He comes across as unsympathetic. In this second installment he just comes across as a spoiled brat.<br/><br/>And what's up with the wife? They just had a child and she feels the need to ""get out of the house"" and go to the studio or something. Do new mothers relate to that? Cos that was a huge talking point among the group of friends i went to see the movie with, mostly friends of my wife. I think that happened so that we could have that scene of Adonis alone with his child but there could've been better ways to bring that about. The story writers gave her this hearing-impairement issue which is passed on to their daughter, maybe to make her more sympathetic. But it doesn't elicit that response. And her singing as her husband walks towards the ring was so cringeworthy. It even ended abruptly. She had her music and that could've been written into the story better.<br/><br/>As for Ivan and Victor, they were the true underdogs in this movie. A father fallen from grace, left by his wife and abandoned by his country, living vicariously through his son's victories, looking for redemption. The movie tries to portray Victor as a brute with barely a line the entire movie but this relationship had potential for so much more friction between a father driving his son to serve his own needs and a son who's a man in his own right who could've had interesting clashes with his father. But no, the movie needs us to root for the heroes so apart from their training montages we rarely see much of the Drago's relationship.<br/><br/>And the Russians. The wife and entourage stand up and walk out before the match is over. And the son and father lose heart. I get that Ivan's point this whole time has been to get his ex-wife's approval/respect and his country's acceptance again but that story is so poorly written it just doesn't hit. With a runtime of over two hours, they should've done better.<br/><br/>The fight scenes are also poorly choreographed and edited it looks uninteresting. Maybe an actor more the size of Adonis for a better suited match would've been interesting. To make Victor that much more bigger for the sake of villanous threat was a mismatch.<br/><br/>I actually wanted Victor to win. The movie was that bad."
"andymclennan","4","124","178","13 February 2019"," So predictable
","I really enjoyed the first film, but this one is so predictable and derivative, they've clearly run out of ideas.<br/><br/>The training and fight sequences (which make a Rocky movie a Rocky movie) only make up a short percentage of the running time.
In between those sequences is where this really suffers - ""Mr and Mrs Creed"" are no Rocky and Adrian.<br/><br/>The fights are decent enough but it's all too predictable.
Time to let this franchise die with dignity."
"colinozz","3","134","197","2 December 2018"," Disappointing rehash
","I love rocky but this movie was slow and predictable, and it made me feel old..."
"AGood","7","6","6","23 February 2020"," We Need a Viktor and Ivan Drago Spin Off
","This movie is not as good as the first Creed. It felt like a remake of Rocky 3 and was just too formulaic. However what made the movie for me was the final scenes where my appreciation of the movie changed by simply seeing the final round from the perspective of the Dragos and the aftermath of the fight with the Drago's.<br/><br/>Adonis is done for, his story arc is ove and I don't want there to be more for him. He is happy and complete. Rocky's story is now done too. But Ivan and Viktor Drago were the only interesting people in this movie. And I simply want to see what happens to them both now after this ending.<br/><br/>I want to see them pick up the pieces and be successful. They've earned it after the ending which was unheard of in a movie of this type.<br/><br/>Please Sly and Dolph make it happen."
"dtnmusic","3","123","190","11 December 2018"," Shows how many fake reviews are out there
","Very MINOR spoilers. First of all, take a look at all the recent 10/10 reviews, and it still sits at 7.8. Do the math. Sad that studio's do that. Anyways, very lame story, way too much forced drama outside the ring. Infact, this is hardly a boxing boxing, it's days of our lives with a few fights in between. I almost walked out 2 or 3 times. 2 people actually did, out of 10. Basically every situation was forced and/or not believable, in a bad way. Next, Michael B Jordan does a horrible job of being the heavyweight champion of the world. Such a pansy throughout, in the ring, and outside. Get this, even as the son of Apollo Creed, even as the champion of the world, he has not one friend or entourage member. Reeeeally. All I kept thinking was, THIS guy is the same status/level as Mike Tyson was? This pansy who has no friends, no money, and goes to a diner with his girl after winning the belt? And the patrons, sort of care he's there? Oh and his woman, who sells out the Fillmore as a singer, doesn't get recognized by the black crowd. Cool. Don't get me started about her singing performance while walking Creed into the ring at one point. Ugg. I'm gonna get writer's cramp. I'm out."
"psychotico","2","83","127","13 February 2019"," Not what I expected
","The first fight was better than the second fight.
Adonis ribs are broken again and he fights as if they weren't broken... very unrealistic and stupid hollywood fantasy. Makes me sympathize more with Drago, no moral in the end, Russians made to look bad for the second time, guess it's easy when they are presented by non-russian actors."
"gashf-86701","3","112","177","1 December 2018"," Terrible sequel
","I'm not sure if I saw the same movie as 90% of the people on here who voted it 9 and above.<br/><br/>I thought it was slow, a movie that lingered on the moody pouting Adonis Creed and his fiancé who is dealing with her hearing loss. Adonis wins his belt early in the film with a unconvincing fight scene and then is targeted by the rejected mommy's boy Son of Drago who is a bit of a beast.<br/><br/>Long and short of it is this film meanders around the slow paced relationships between Adonis, his wife to be and Rocky. It never really gets going and then it really gets unrealistic when you see the head to head between Creed and Drago with Creed clearly being a super middleweight at best against the heavyweight Russian. It's as if boxing has thrown out all its weight classes and put AJ in the ring against GGG.<br/><br/>I won't give much more away but I considered walking out during the early stages of the film but was interested to see how it ended. Was funny to see Brigette Nielsen back though and Ivan Drago cuddling his son at the end.<br/><br/>Hopefully Sly will hang up his gloves after this one."
"magnum-ajt","3","54","81","14 February 2019"," Cure for insomnia
","I never thought a movie with Rocky Balboa could ever be so boring. I was excited about the premise but the movie fell way flat."
"MJL_Uncensored","9","181","298","24 November 2018"," Delivers the Kind of Punch You Expect
","You have to give Sylvester Stallone credit--he has a gift for remixing the same movie over and over and again and making you actually care. Maybe it's because he focuses on the one thing that matters most in storytelling: compelling characters. And Creed II is full of them.<br/><br/>First, there's Adonis (Michael B. Jordan), the brooding, bratty, world champion with a chip on his shoulder. There's Rocky (Sylvester Stallone), the downtrodden wise sage who only recognizes his role in things when the chips are down. There's Bianca Taylor, a talented singer suffering from hearing loss and her love for a self-destructive boxer. There's Mary Anne Creed (Phylicia Rashad), the weary widow of Apollo Creed who is consistently forced to check her man-child son, and then there are the villains. Ivan and Victor Drago (Dolph Lundgren and Florian Munteanu), the Russian outcasts seeking redemption for the failures of Ivan Drago. Everyone has a purpose in this film, and everyone has a place in moving the narrative forward: avenging the actions of Rocky IV.<br/><br/>This is a straight-up reboot of a Cold War classic, complete with the final match taking place in Russia. You know what to expect. The challenge from Ivan's son is the kind of storybook rematch the sports world loves. You know Creed has to take the fight to prove himself. And you know at some point, Victor Drago will get the better of him, setting us up for a training montage that never seems to get old. You see, when Rocky IV was released, it wasn't just a boxing film, it was practically a propaganda film about the superiority of American values and ideals. In Creed II, it's not about the country--it's personal. It's about discovering what matters most to you in your career and your own life. And as cliched as that may all sound, it works amazingly well in this film, thanks in part to the strength of the movies character development, phenomenal actors who keep the theatrical bits grounded and brilliant fight choreography and cinematography to settle scores.<br/><br/>I'll be straight with you, we shouldn't like Adonis Creed, but we do. He's a temperamental grown man baby that even knocks himself in the movie for ""acting like a b---h."" We shouldn't care about Victor Drago--he's a carbon copy of his android like father Ivan and barely has enough dialogue earn a film credit. But we do because we know that his father is living through him. The once powerful Ivan is an outcast in his homeland, and Victor's mother walked out on both of them because she has no respect for losers, so they're surprisingly sympathetic characters in their quest to be menacing. And we shouldn't care about Rocky's meandering ruminations about putting family over boxing when at no point in his career, did he ever do the same. Yet somehow this movie manages to make you care because the film understands that it's real power are in those small reflective moments building up to the fight. Moments like Creed's return to the local cheesesteak house and being welcomed by the fans who urge him to take the battle against Drago. Moments like Bianca and Adonis laying on the floor together like they did in the first film pondering their relationship and what Adonis's decision means for them. It's moments like Rocky pondering the broken relationship he has with his own son and trying to figure out if he dares to make amends. This is the glue that holds these films together--putting family above career and ego. And when it finally comes time to fight, your emotions are so heavily invested in the outcome that you'll find yourself (as did my audience) verbally cheering on Adonis Creed.<br/><br/>And in the end, it's the smallest of gestures by Sylvester Stallone (which I won't spoil) that lets you know that Rocky Balboa has nothing left to give and it is now Adonis Creed's time to shine in whatever sequel they have planned for us. Creed II a great time at the movies, even if it's a predictable one."
"bledingham74","10","256","431","21 November 2018"," Seriously considered walking straight into the next showing when it was over
","All movie I kept looking at my watch because I didn't want it to end. It was 130 minutes that felt more like 45.<br/><br/>The fights (and there were more than normal) were great, but the movie was much more than about the fights. It was about family, loss, motivation, legacy, and the part that really touched me was the focus on fathers and sons.<br/><br/>Dolph Lungdren and The Big Nasty were perfect villains, but unlike most movies you see the loss that the villains endured and what shapes them. I couldn't help but feel for them a little too - particularly the son.<br/><br/>Sly was obviously great as Rocky, and he was more down to earth and relatable than ever. Smart how they keep fading him more and more into the supporting role as Caple, like Coogler do a great job of remembering he is not the focus. I loved that Little Duke got more of a roll, and I think that he's someone who would be able to carry the franchise as mentor/coach if Sly ever decides to give this up. Phylicia Rashad was charming as MaryAnn, and you could feel her emotions going through this again with the family who took her husband's life. MBJ and Tessa Thompson were absolutely brilliant, and their chemistry is just so natural. Bianca walking out with them and singing leading Donnie to the ring for the final fight - CHILLS!!!<br/><br/>The ending fight sequence, and what happens after and how they have separate endings at the same time for Donny and Rocky made it the best ending of any of these films.<br/><br/>As a lifelong Rocky fan (my Dog's name is Clubber), I think I actually like the Creed franchise more. I like the cultural difference with Creed, and it just seems more grounded and for lack of a better word quality writing and directing. If they make 10 more I'd go and see all of them!"
"dollsteeth","3","88","146","1 December 2018"," Don't believe the hype...
","Essentially choose any of a number of prior Rocky cliches, roll them in a ball and jam them into your eyeballs whilst playing hip-hop:<br/><br/>Creed 2.<br/><br/>Actually left the cinema to get better 3G to download (already seen) Alan Partridge episodes, that's how tonk this film is."
"vladanzivanovic","1","113","191","9 December 2018"," Absolute trash, you can polish a turd but it will always be a turd.
","Spoilers? Nothing you haven't seen in the trailer...<br/><br/>This in honest assessment. I'm not going be dishonest to you like the others will.<br/><br/>There are many issues. Firstly, this franchise should never been made.<br/><br/>This movie is nothing but a sad cash grab. You can't bring back a killer in Ivan Drago and pretend it is all cool, and yes it could of worked, IF they established Ivan Drago's return sooner in the series, maybe hinted him in the first Creed, and at least give him some back story, maybe show a flash back, just anything... what is going on here, and have not been this disappointed since Star Wars Episode 8. The problem here is, there were way too many loop holes, and plot issues, mistakes, decisions Stallone even regrets that were made in the previous Rocky sequels, for anyone to be able to patch things up and move forward.<br/><br/>Adonis Creed, the character you gave a chance, but in the end, he is just too damn unlikeable, and complete child with a loud mouth, throwing tantrums, disrespecting Balboa as well. ""I'm dangerous"" after hearing that, I couldn't help but burst out laughing... yeah, real dangerous!<br/><br/>At least Apollo was serious enough as a character, and had the qualities that were likable.<br/><br/>Unfortunately in Creed II, I just can't help rooting for the other guy. Plus Creed is way too small in size to take down the Russian, makes no sense at all. Why did Creed want to fight Drago Jr? Creed was adopted and never knew his real father, so it felt forced and really had no place as a story, because like I said ""too many issues from previous Rocky sequels"" that are completely unsalvageable.<br/><br/>To make it worse, the antagonist Drago Jr came across as a big teddy bear, just didn't feel he was menacing enough, awful casting decisions cost them in a big way. The writing of Drago Jr character gave him about as much character as a turnip and it didn't work, at all. Not to mention Viktor Drago looked nothing like his parents, so I ask the question - was he adopted? Perhaps Viktor and Adonis share something in common, if they decide to make a 3rd part, heaven forbid.<br/><br/>The music, forgettable, bad, just complete garbage, who green lit this?<br/><br/>They were also trying too hard to make the premise feel like real life, which is the same mistake Rocky 6 did with bringing in subpar real life sports commentators, just cheapened the entire production. It was like watching a typical ShowTime boxing advertisement on pay TV, not an A grade film production.<br/><br/>No wonder Stallone retired Rocky, after watching the dreadful performances throughout the entire cast, he did the right thing and had no choice but to shelve Balboa once and for all. Also I was disappointed with Stallone in this one as well, was he trying? Or was it the writer's fault? Did the creators not watch any of the previous films? They should be ashamed of themselves, pathetic effort folks.<br/><br/>If things couldn't get worse, think again. They cut the Ivan Drago vs Rocky Balboa fight in the hospital, they also cut Spider Rico's funeral, and... they cut the locker room scene between Adonis Creed and Viktor Drago. IF they added these scenes? And dropped the crappy music? Who knows, it could have been watchable.<br/><br/>Balboa is also not his punch drunk self either, it's like an alternate timeline movie, it felt like something else. It's not the Rocky we grew up with.<br/><br/>They will tell you, it's just like Rocky 3 and 4, and they will tell its great! They will say ""long time Rocky fan"" but really if they were? They would just tell it how it is, and they will tell you that Creed II sux."
"DomNickson843","1","93","158","4 December 2018"," Completely unnecessary.
","This film is completely unnecessary just like the first movie. Adonis Creed is such a lame, cocky, unlikable character. In every fight scene he gives off that ""Jerkface"" vibe. I mean even the opponents in the first creed are rediculous and unmemorable. Everytime I saw the first ones trailer I was like, ""Why did you make such a cash grab of a series?"" It was basically a cloned tumor leaching off the success of the brilliantly written Rocky series. It wanted to be Rocky so bad but it sucked!<br/><br/>Then I heard about this sequel and I couldn't help but feel that this movie could of worked if they presented it in a way as if Adonis was going to join his father Apollo's side six feet under. I think that maybe if they built Drago's son up like they did in Rocky IV they would of had the suspence they needed to pull it off. However, Drago's son doesn't have too much build up because this film is focused more on Rocky and Drago's past. These two stole the show even if they weren't trying to.<br/><br/>The ups for this film: The old school cast reunites. Other than that everything is overdone and honestly makes me rather watch Rocky IV again."
"paul_cush","6","30","47","7 December 2018"," Soulless
","I paid half price to see this, and felt I paid for what I saw. For instance, it's predictable. There was quite a few scenes that did nothing for progressing the movie. I wondered why they moved Adrian's grave to a new location. I wondered why they didn't make Drago's ex wife (Bridgette) walk over to Apollo's wife and say good luck like she did before, only this time she could have told her to fk off? I wondered why Rocky was telling D to not fight Drago when Rocky didn't exactly the same thing to avenge Apollo's death? The movie was dry and soulless. The music could have been inspiring in moments to move you along. Father Drago could have been a lot more human and aggressive than just plain angry and silent. They rushed this movie."
"ronaldon-16019","10","227","419","15 November 2018"," So freaking good
","From the beginning to end, the directing was so good. The script was so well written and I love it. Best movie of the year"
"ashishbedi-69472","1","61","107","15 December 2018"," It's nothing new
","I wonder why this movies got such high ratings. There is nothing new in movie, just the old repetitive story , rocky comes to rescue. I think they should stop making movies on rocky anymore .Being a ordinary guy I can write better script than this story. What a waste of time and money"
