"username","rating","helpful","total","date","title","review"
"stinadianne","8","2","6","13 June 2014"," A beautiful film that matured along with it's characters
","How to Train Your Dragon was a surprise hit, even to Dreamworks- the studio that released it. The masterfully animated and scored story of a boy and his dragon captured hearts and minds everywhere and naturally lead to a franchise. Much like it's predecessor film, How to Train Your Dragon 2 is packed full of tons of heart and humor but it does something unexpected, like it's characters- it grows up.<br/><br/>It's five years after the events of the first film. The little Viking town of Burk is now a bustling and active haven for dragons. When Hiccup (Baruchel) and his dragon, Toothless, discover an ice cave that is home to thousands of dragons and Hiccup's long lost mother. After meeting fellow dragon rider Valka (Blanchett), they must fight to defend the safety of dragon and human alike from the evil Drago (Djimon Hounsou), an evil dragon master who plans to build an army of dragons to control humans.<br/><br/>The whole gang is back and more hilarious than ever, but they are older now and have new fights and complaints. Snotlout (Jonah Hill) and Fishlegs (Christopher Mintz-Plasse) now vie for the affections of Ruffnut (Kristin Wiig). Astrid (America Ferrera) is now a full fledged Viking warrior woman and looks awesome flying her dragon around with just as much skill and bravery as Hiccup does. Hiccup is no long the scrawny, nerdy, and self-doubting lad he was before. He's a self assured twenty year old man who has found his place atop the back of his trusty dragon best friend, Toothless. Baruchel's voice is just as nasally as ever but when the movie turns serious he can pack an impressive emotional punch. Astrid and Hiccup are the cutest Viking couple and having now been together for years, they save the audience from any awkward first steps of love. It's refreshing to enjoy a young couple with a healthy relationship, making it possible for them to just be there for each other when they need it.<br/><br/>John Williams delivers another exuberant score and the music he composes is somewhat outside of his traditional canon. Williams usually arranges in a more classical realm, but like Toothless and Hiccup, he goes above the clouds and beyond with his Gaelic inspired and overwhelmingly beautiful pieces for the How to Train Your Dragon films.<br/><br/>There are many beautiful and poignant moments that make up HTTYD 2. One is an early conversation with Astrid and Hiccup- the scene is very well written and helps the audience naturally relax into their relationship. Another is a scene where Stoic (Butler), Hiccup's father, is reunited with his long thought dead wife. All of these little moments are so well written and exquisitely executed you might forget you are watching a movie made for children, and that is why these movies ascend from other Dreamworks pieces. Hiccup is faced with many adult emotions and it's fascinating to watch him explore them, but on the flip side it's also fun to see cute dragons show off some slapstick comedy. Just because a movie is marketed for children does not mean it can only be enjoyed by children. The How to Train Your Dragon movies are examples of lovingly crafted films made for everyone.<br/><br/><ul><li>See more at: http://www.mediumraretv.org/review/how-to-train-your- dragon-2/#sthash.7h5iwGbv.dpuf</li></ul>"
"Pavan_Daggupati","8","2","6","12 June 2014"," Big and Beautiful
","Dream works trump card How to train your dragon was one of my favorite animated movies of all time. That one was a charming and heartfelt story. This installment was beautiful (thanks to Roger Deakins), funny at the start, tragic in the middle and heroic at the end. <br/><br/>It just delivered what we want.<br/><br/>Toothless was great and he stole the show in the climax. Not a great story but it has enough elements to keep the viewers intrigued till the climax which all of a sudden delivers a power packed punch and then you can't help but to cheer for Hiccup and Toothless. <br/><br/>The treatment was little predictable but the 'chief has come home'. <br/><br/>Music score, Animation and 3D were great too.<br/><br/>Best film of the year so far. Cheers !"
"Lathspelll","8","2","6","12 June 2014"," Classic phoenix theme on an epic scale
","This deserves a round of applause. As some fellow reviewers have said kids as well as adults will have fun watching and re-watching it. I certainly will. Having seen the Dreamworks Dragons series as well as the first movie(multiple times), I believe I do justice in saying that this was a very apt culmination to the great build up. The emotions are more personal as all characters are grown up and allow the young adult generation to identify ideals such as sacrifice, leadership and love. At the same time, the maturity is shown only in glimpses to keep the realm still limited to childhood thereby keeping its younger audience spellbound. The decision to include such grand dragons and to include the lost hero like feeling in Hiccup gave the drama a very Arthur-esque touch. The bond between him and Toothless seems stronger than ever and is given ample screen time with enough ups and downs and the desire to perform that daring maneuver with perfection lasts till the end with a cliffhanger. While the last movie was about Hiccup changing others' views about dragons here he grows suddenly into responsibilities of a leader and is thrust in danger to lead his clan from its worst threat ever. Coming to the phoenix theme as we have seen in Harry Potter, Gladiator and Spartacus, the ultimate hero rises from the ashes of his loved ones. The resemblance is not lost here( for details watch the movie). But at the same time this serves a dual purpose as he also gains a new mission in life and finally understands his purpose. The finale of the whole extravaganza is not in hindsight. With an able captain at the helm a new script can maybe make this series a very successful trilogy."
"shawneofthedead","9","2","6","12 June 2014"," A fine, brave, funny and heartfelt sequel, fully worthy of its predecessor.
","Animated movies are not immune from the dread cinematic curse of sequelitis. Often, the desire to bring in bigger bucks at the box office results in the successive installments of a franchise fading into mediocrity. Of course, Pixar has bucked that trend with its quite spectacular Toy Story trilogy, in which each individual film stands proudly as one of the finest the medium has ever produced. But few other animation studios have managed to create sequels of comparable quality to their original big hits - until now. How To Train Your Dragon 2 is an unqualified delight, a sequel with just as much heart, ambition and sweeping emotion as its predecessor.<br/><br/>A few years after the adventures of the first film, the once anti-dragon Viking village of Berk is now fully integrated with dragons. Hiccup (voiced by Baruchel) explores the high seas with his trusty dragon companion Toothless, partly to avoid his dad Stoick's (Butler) constant attempts to mould him into Berk's next leader. In the course of his explorations, Hiccup stumbles upon the icy hideaway of a mysterious dragon-rider (Blanchett) - one who has spent years trying to keep the majestic beasts safe from the bloodthirsty Drago Bludvist (Hounsou) and his nefarious plans to build a dragon army.<br/><br/>Anyone who was charmed by the endlessly charming How To Train Your Dragon would approach this sequel with excitement - but also some apprehension. The first film was such a pleasant, perfect little surprise: something genuinely heartfelt, emotionally powerful and raucously funny - the kind of film we would, frankly, expect from Pixar and not from DreamWorks. It was anchored on a story at once full of innocence and depth, as a boy struggled to find his way and his voice in a world in which he doesn't belong. What story is there left to tell, one might worry, now that Hiccup has successfully bucked Viking tradition and settled more comfortably into his own skin?<br/><br/>Plenty, as it turns out. How To Train Your Dragon 2 takes as its premise the intriguing - and very realistic - notion that growing up is a process that never ends. People evolve, as the problems and possibilities in their lives do. Just because Hiccup and Toothless found a happy ending in the first film doesn't mean their lives will be perfect from here on out. Instead, it all gets increasingly complicated, as it tends to do when one gets older and the world more complex. As Hiccup tries to evade his political responsibilities, he's called upon to open up his heart again when he realises that the aforementioned dragon-rider is none other than his long-lost mother Valka (a plot twist revealed way in advance in trailers for the film).<br/><br/>This is actually where the film really triumphs: in allowing its characters to grow, age and mature, just as they would in real life, it unearths great insights about its characters and the human condition. There's Hiccup's relationship with his dad: much improved from years ago, but still based on Stoick never quite hearing what Hiccup has to say for himself. The almost heartbreakingly tender relationship between Hiccup and Valka is also masterfully developed: we realise that his affinity for dragons is what gave her her life's mission, which helps to soothe away much of the pain and loss stemming from her absence. Even Hiccup's ongoing love story with Astrid (Ferrera) is given room to breathe: we can easily see why they're still a great match, now that they're a few years older and no longer engaging in playground teasing and flirting.<br/><br/>At the heart of the film is also its brave, bold decision to tell a story that confronts the pain and tragedy of loss, head-on, with no fairy-tale happy ending as we've come to expect of all animated (and many Hollywood) films. In Valka and Stoick's reunion, you can see the years of misery that stretch between them, hardly scrubbed away by a bittersweet moment in which they share a song from their past. Later on in the film comes a moment of quite spectacular drama and tension, one that has the potential to break Hiccup in two, or to turn him against his best friend Toothless. It will shock audiences, and perhaps shatter them emotionally, but its bold, emotional truth is part of what makes How To Train Your Dragon 2 such a worthy successor in the franchise.<br/><br/>That's not to say the film is an exercise in melodramatic doom and gloom; it isn't. There's plenty of humour and sheer, unbridled joy to be found alongside its humanity - whether Hiccup is soaring through the clouds with Toothless by his side, or his buddies Snotlout (Hill) and Fishlegs (Mintz-Plasse) are vying stupidly for the affections of a largely unreceptive Ruffnut (Wiig). It's also, quite literally, a sight to behold: battle and aerial scenes, many with the heaving, swirling ocean as a backdrop, are gorgeously animated. It's easy to get the sense that this really is a full-fledged world, one that Hiccup and his audience are only just beginning to map out.<br/><br/>If there's anything that brings How To Train Your Dragon 2 down, it's the film's villain. Drago is a frustratingly two-dimensional character in an impressively three-dimensional world, one who snarls and stomps through his scenes with much menace but hardly any depth. It makes the final act of the film - packed as it is with action sequences and stand-offs - feel a little empty.<br/><br/>All in all, How To Train Your Dragon 2 is a fantastic example of how a story - even one geared to appeal to children - can deepen, mature and grow. It's every bit as entertaining for the kids (Toothless remains the best animated pet-kitten/puppy/dragon hybrid ever), but also allows its audiences to experience fresh challenges, joys and heartbreaks with these characters we already know and are now given the opportunity to love all the more."
"mtg138","7","4","17","13 June 2014"," Classic case of Over Expecting i think
","Huge fan of the first movie. Really wanted this movie to be better and justify the present rating of 8.8 going on IMDb.<br/><br/>The animation was brilliant. The Dragon size and features were awesome. <br/><br/>But the story content was slightly lacking. They made a very good premise, launched at a very good scale but then suddenly it seemed at the end that they backed off from creating a really engrossing masterpiece. <br/><br/>I was sitting in the movie raptured at the start but at the end i just couldn't avoid a thought that came to my mind which went something like- ""meh..""<br/><br/>I think if they had spent a little less time showcasing the carefree dragon frolicking and spent some more time strengthening the action scenes it would have been a far better movie. <br/><br/>Compared with the first one this movie has less comic element, less of a climax and lesser cohesiveness in the script. <br/><br/>Overall a nice movie for everyone but yeah, not to curse yourself with too much expectations will be my advice."
"bradleygranz-65128","10","1","2","24 January 2020"," One of the greatest sequels of all time
","How to train your dragon 2 is a masterpiece in animation history if you want to talk about the amazing relationship between hiccup and astrid and the best friendship all time hiccup and toothless this probably my favorite soundtrack in the how to train your dragon trilogy and I love how dark this movie gets. Also great battle sequences and great villain there so much to love about how to train your dragon 2 just watch it do your self favor and do it"
"carldarn","10","1","2","20 October 2019"," A great follow-up that feels natural
","How to Train Your Dragon 2 is a worthy follow up that's easily on par with the first, if not even better. It boasts the requisite stellar visuals and talented returning voice cast, that alone gives it six stars. The way the story progresses in such a natural, satisfying way that doesn't feel forced yields two more. (So far we're at eight.) The emotional beats work on so many levels. Whether it's watching Valka reunite with Hiccup and later Stoick or the sacrifice and funeral of the latter, you're made of stone if you don't tear up even just a little bit. Just saying. I give it one more for that. (Now we're at nine stars.) And now for the most important ingredient that yields the tenth and final star. (Insert drum-roll here.) TOOTHLESS IS SO ADORABLE! HE'S JUST SO CUTE! Okay, in all seriousness, while Toothless is easily responsible for some of the first six stars, the tenth star has gotta be given for John Powell's amazing score. Every track makes each scene feel exciting, (Dragon Racing, Battle of the Bewilderbeast) wondrous, (Together We Map The World, Flying With Mother) dark, (Meet Drago, Alpha Comes To Berk) emotional, (Stoick's Ship) and even satisfying. (Two New Alphas.) All this comes together to create an excellent experience that's worth re-visiting."
"blackwidowis7cool","10","1","2","24 June 2019"," Excellent sequel
","How to Train Your Dragon 2 is amazing!
The animation is superb - much better than the first one. The acting is amazing, as usual, and everyone does a good job and bringing you into the characters and making you care about them.
Very emotional and some surprising twists and turns.
Awesome villain. Perfectly cast, as well, I might add.
Breathtakingly perfect at some parts and very sweet. Brought tears to my eyes at some points.
Definitely recommended."
"drewstar2012","10","1","2","28 February 2019"," Tears and laughter abound!
","One of the best animated movies ever!
Best animated visual effects and crisp visuals I've ever seen and oh the feelings.... If you have a heart or have ever been in love, your movie will tear at your heart strings - hard.
But there is also plenty of drama, action and comedy in the mix!<br/><br/>If you loved the first one and the TV shows this one goes above and beyond. You won't regret it!"
"paulclaassen","9","1","2","3 July 2018"," Even better than the original.
","To call it spectacular is too mild a word. This is perfection in every way. A lot more thrilling and exhilarating than the original. The animation is AMAZING. Definitely aimed at a more mature audience."
"samtimoney-79758","9","1","2","23 June 2018"," Even better than the first
","Love this film, this franchise, unlike frozen, has a soul, great and normal animation where everyone doesn't look like perfect Chinese manga girls like most Disney films, there is a dark twist, it isn't all lovey duby like most films and has a great ending. 
Love it, one of my favourite animated films"
"gamecaster","10","1","2","3 April 2018"," Amazing movie!
","This movie is amazing just like the first! In my opinion the first is better but this is still awesome! I loved this movie and I don't think I could made it better! Just like the first this movie has good comedy, action, character depth and an amazing main character. The thing I love most about this movie is hiccup and toothless! Hiccup is such a funny character in the first movie but in this one not so much however he manages to make for this by having an even stronger bond with toothless! <br/><br/>If u guys see this movie anywhere please do urself a favor and watch this phenomenal movie!"
"hansefde","9","1","2","3 January 2018"," Even better than HTTYD1
","Rarely a sequel is better than the first one, but here it is. The graphics are stunning, but more importantly the story deals with difficult questions. While the first movie was about trust and friendship, How to train your dragon 2 is about dealing with the death of relatives, becoming mature and being able to take responsibilities. It's a big step for a teenager becoming mature and this movie deals with it brilliantly. Yes it's an animated movie, but adults will like it as much as children. One to watch for the whole family. An epic movie."
"Animated_Antic","10","1","2","18 September 2017"," A thrilling, epic and fantastic sequel.
","Now this is how a sequel is done. For a while, I haven't seen a sequel to animated movie that is not only good, but better than the original. Until now. ""How to Train Your Dragon 2"" is the perfect description of a movie that conquers the first film and keep in mind, the original movie was probably the best animated movie DreamWorks has ever put out. This movie continues the story like a good sequel should and also ups the story, characters and animation in the process. I even think this is one of the best animated movies ever made and have so much to say about it.<br/><br/>Five years have passed since the last film and the Viking village of Berk has evolved. The island now lives with their former nemesis, the dragons, in harmony and have even turned many of their former weapons of war into items of use for the dragons like turning giant torches into feeding stations. Hiccup (Jay Baruchel) and his dragon Toothless have been exploring and mapping islands outside of Berk in hopes of finding other dragon riders. He instead discovers dragon trappers who are seeking revenge after their fort was destroyed and solidified by ice. Led by Eret (Kit Harington), he reveals that the warlord Drago Bludvist (Djimon Hounsou) is raising an army full of dragons in hopes of conquering the world. After warning his father, the chieftain Stoik (Gerard Butler), the island of Berk is put in a secure state to protect the dragons in preparation for a war. Hiccup, believing the war can be avoided, leaves the island with his girlfriend Astrid (America Ferrera) in hopes to talk with Drago and prevent the battle not knowing that they aren't the only ones protecting dragons. I could tell you what happens next, but I'd rather not spoil the movie.<br/><br/>While the last film was directed by ""Lilo and Stitch"" directors Chris Sanders and Dean DeBlois, this film is rather written and directed by DeBlois himself who plans to turn the series into a trilogy. He claims he mostly got inspiration from ""The Empire Strikes Back"" and it clearly shows. The film does what a sequel should do. The film expands the world, introduces more new characters including more species of dragons and also the fun. The story is what I love about this film the most. It ups the emotion, heart and comedy from the previous movie while also taking the movie in a more darker and serious tone. One particular scene near the end of the film was so powerful that I actually did get a little teary eyed which is a very high compliment. The animation is some of the best put to film. With help from visual consultant Roger Deakins, the animation was so beautiful and even at times very realistic. There was one shot in the film involving glaciers that looked so realistic that I initially thought it was filmed on a camera. The character are again, fantastic. They evolve like characters should, while keeping their charm that we liked about them from the previous movie. The new characters are also fantastic with the villain Drago Bludvist being a genuinely unlikeable villain while having a believable backstory to explain his actions. My favorite character is still Toothless who can be both cute and funny at times while also being epic and awesome in others. I can go on forever praising this movie, but I'd rather not.<br/><br/>""How to Train Your Dragon 2"" is one the best animated sequels ever made. This is a film that has everything I expect to a sequel. A story that is as good if not better than the original, some breathtakingly real animation, and fantastic memorable characters. It's really a fantastic movie and I'm pretty excited to see where the story goes next. There are many reasons why DreamWorks is considered one of the best animation studios in the business and this is most certainly one of them."
"dfranzen70","8","1","2","16 March 2015"," Flyin' high
","How to Train Your Dragon 2 is a decent follow up, for an animated sequel, and kids and other fans of the original should be happy with it. In it, our former Viking nebbish Hiccup (Jay Baruchel) is now the hero of the town of Berk, which is still ruled by his dad, Stoick (Gerard Butler). Peace reigns in Berk; instead of endless fighting and pillaging on the part of the marauding Vikes, dragons and men are friends of a sort. Even the most hardened of savages favors the flying reptiles.<br/><br/>Hiccup knows that his dad wants very badly to be the next chief of their Viking tribe, but he himself doesn't want to follow in those large footsteps. While scouting with his own dragon, Toothless, Hiccup discovers an island that's part land, part ice - in that there are huge shards of ice skewering the island and the domiciles. Then he - and his gal pal Astrid (America Ferrera) and her dragon - are trapped, partly so that Hiccup can find out more about this new place. And it quickly comes out that the band of men on the island have been attacked several times by dragons and that they themselves are, in fact, dragon trappers. They're catching dragons to serve in a dragon army ruled by Drago (Djimon Hounsou), who's naturally out to rule the world.<br/><br/>The Dreamworks animation is fine - as good as in the previous movie, anyway - but more importantly the voice characterizations are great. In one fun scene, Astrid pokes fun at Hiccup's speech mannerisms, which of course mimic those of the real-life Jay Baruchel: a lot of shrugging and hand-waving. Jack Black, Christopher Mintz-Plasse, Jonah Hill, and Kristen Wiig voice Hiccup's friends, and Kit Harrington (Jon Snow on Game of Thrones, who knows nothing) plays a duplicitous dragon trapper. Oh yeah, and Cate Blanchett's there as well.<br/><br/>The movie and its predecessor are based on a series of books by Cressida Crowell, and there are plans to make a third film. No surprise there - the sequel did great box office and was nominated for an Oscar for Best Animated Feature. And while the effects and action make for a wholly entertaining movie, there's some beautiful, quieter moments, between parent and son, girl and boy, boy and dragon. A fine offset to the comic-book mayhem surrounding it."
"851222","8","1","2","16 February 2015"," Good but not as great as the first part
","Greetings from Lithuania.<br/><br/>""How to Train Your Dragon 2"" (2014) is a colorful, big, amazing looking follow up to the one of the best animated movies in a long time. It's visually amazing, and although it doesn't feature anything groundbreaking in visual department, it looks fabulous. The story here is probably were this movie felt a bit for me. It's good, but not engaging as the first one was. ""How to Train Your Dragon 2"" expands the universe of the first picture and gives some new characters, but only one of them was interesting - voiced wonderfully by Cate Blanchett. <br/><br/>Overall, ""How to Train Your Dragon 2"" is a true big screen experience for almost all ages. It's looks and sound wonderfully, and although the story isn't anything new or special, it's definitely worth seeing. There were moments were i felt this movie dragged a bit in the middle section, but it has one interesting turn of events near the end of the movie that i didn't see coming."
