"username","rating","helpful","total","date","title","review"
"gavin-thelordofthefu-48-460297","10","2","3","2 March 2018"," The franchise continues to soar thanks to the film's compelling story, strong emotional depth, and characters that are still great
","Hi everyone. This is gavin.thelordofthefuture and today's the 2nd of March which means that the third and final installment of the How To Train Your Dragon trilogy will be out in one more year. So, I'm going to review this second installment that came out almost four years ago.<br/><br/>After the success of the original film in 2010, DreamWorks started production on the sequel. Dean DeBlois, who directed the first film with Chris Sanders, revisited the films from his childhood, My Neighbor Totoro and The Empire Strikes Back as inspirations for the film to focus on the scope, the characters, and the fun. The original voice cast including Jay Baruchel, gerald Butler, Craig Ferguson, America Ferrera, Jonah Hill, Christopher Mintz-Plasse, T.J. Miller and Kristen Wiig returned fo the sequel along with three new additions like Cate Blanchett, Djimon Hounsou, and Kit Harrington from Game of Thrones. Then, after finishing the design and look of the film itself, it came out to theaters and was met with critical acclaim, with praise for it's animation, voice work, action sequences, John Powell's musical score, emotional depth for the characters, and the more darker and serious tone compared to the first film. So, having loved the original, this sequel blew away my expecations and is the best animated sequel from DreamWorks since Shrek 2, Kung Fu Panda 2, and Madagascar 3.<br/><br/>How To Train Your Dragon 2 shows Hiccup trying to take responsibility when he becomes the chief of Berk. Suddenly, a threat occurs when the new villain named Drago Bludvist sets to conquer the world and it's up to him and the other dragon riders, along with Hiccup's long lost mother, Valka, to save it.<br/><br/>This film is a reminder of a second installment done right. It reminds me of Kung Fu Panda 2, also a great sequel to the original film, which I also loved as well. Because not only does it provide a compelling story with breathtaking flying moments that are as good as the original film, excellent action sequences and emotional moments (the flashback of Valka being taken by the dragons, the reunion of Stoick and Valka, the death of Stoick (SPOILER ALERT to those who haven't seen the film yet), Hiccup's attempts to free Toothless from the Bewilderbeast's control with the power of compassion and friendship) but it does a great job in expanding on the original film by making the new characters and villain have a connection to how the war between the Vikings and Dragons started. The new characters are great. Valka (voiced by Lady Galadriel-I mean Cate Blanchett) is a female side character done really well because of her relationship with Hiccup and their perspectives on how to create peace for all the dragons and vikings of Berk. Eret, the dragon trapper and working for Drago Bludvist, is really entertaining and while having some menacing moments, he also has some hilarious moments. And last, but not least, Drago Bludvist. Some people considered him to be a generic villain wanting to conquer the world, but to me, he's one of DreamWorks Animation's best villains since Rameses, Tai Lung, and Lord Shen. The reason why his connection to how the war between Vikings and Dragons started make sense is because his people were slaughtered by dragons is what drives him to use dragons to bring fear to other people.<br/><br/>That being said, the rest of the film maintains the same strengths that the original film had. Hiccup continues to be relatable due to his struggles by trying to take responsibility as chief of Berk and his relationships with Toothless, Astrid, Stoick, and Valka are beautifully written. The other dragon riders Astrid, Fishlegs, Snotlout, Tuffnut, and Ruffnut weren't given as much screentime, I'll admit, but they contributed a little bit more to the plot while still providing some great humor particularly with Ruffnut, whose expressions when encountering Eret became really hilarious. Stoick, whose stubborness changed after the end of the original film, is still a great chief and shared his emotional moments with Valka perfectly while Gobber is still a funny side character. The animation continues to be beautiful from the landscapes, the even more unique character animations and movements and expressions so beautiful. And last but not least, the music score from John Powell and he did a great job. He reprises the themes from the first film while introducing new themes for the new characters, but not only that. It retains the scottish tone and provides some really strong action music writing while also being as epic, dramatic, haunting, and emotional as ever.<br/><br/>Overall, How To Train Your Dragon 2 not only managed to be as good as the original film, but reached the mature heights for DreamWorks Animation since The Prince of Egypt. I cannot wait for How To Train Your Dragon 3! Solid recommendation to fans! :)"
"Purple-Dragoon","5","2","3","30 November 2017"," How to Train Your Dragon 2 VS. Kung Fu Panda 2
","What these two films have in common is that they are both DreamWorks Animation sequels and both of them have darker content compared to the first installments and both have two plots, in which one is about family related and the other one is about stopping a central villain. The difference between those films however is that one of them managed to tell these plots right and therefore I compare them in this review. (Spoilers for KFP 2)<br/><br/>KFP 2 starts with a short intro about the past of a character that becomes the main villain of the story, followed by a village raid for resources. Po (who is now the Dragonwarrior) tried to stop them but meanwhile gets a short vision of his mother, by seeing a symbol carried by the evil leader. Later he asked his ""father"" about his past, but in the end Po learned nothing other that he is adopted. After that we see how Shen uses his secret weapon that can outmatch Kung Fu and both plots are settled in only 20 minutes of the film.<br/><br/>Now in HTTYD 2 we have to wait 30 minutes before one of the plots comes in light(Hiccup's missing mother) and we have to wait another 15 minutes before they finally introduced the main villain. The only things we know before that is that Eret works for him and that this villain went once to Berk and killed plenty of Vikings there, because they didn't want to obey him, but why not intimidate those Berkians with his dragons like the way he intimidates them? Oh and apparently he also managed to control an alpha dragon. How he did this is beyond me, but most of all his motive to conquer other people. After one hour Drago explains why he needs to intimidate all these dragons by literally showing his lose, caused by dragons and his motive is therefore to force dragons to work for him? He does not kill them though, he just uses them in his advantage to conquer other lands for no good reason actually, because his past is barely related to this. In short we got a villain with an illogical match between motive and that simply gives no satisfaction to Drago's character whatsoever.<br/><br/>Now in KFP 2 the main villain is 'Shen' who is heir to the throne of Gongmen City and he discovered a way to transform firework into a weapon of distruction. This makes it believable (enough) that this position makes him hungry for more power. And it was from the message from a soothsayer that Shen went out to destroy those (the panda) who could be a thread to him should he continue with his plan. He got banned by his own parents and he return after they were gone.<br/><br/>This is something I am willing to buy. It was not perfect, but Shen's actions made far more sense in contrast to Drago. KFP 2 managed to connect the two plots too. I am not saying that different plots should be connected, but this way the story is more complex and conherent and therefore it was more interesting than HTTYD 2 imo.<br/><br/>Yes, HTTYD 2 kept the two plots separate and it was only at the middle where they come together, which is not that interesting because the film lost therefore the pace. It was after 30 minutes Hiccup coincidentally found his mother Valka(really do love the voice of Cate Blanchett) and after they got to her hideout. She said that she only left in order to 'protect' Hiccup, but against what? Dragons will still come to raid the village anyway. If she truly wanted to protect Hiccup and the villagers, then she would've taken every dragon away from Berk. The only reason why she left is because she disagrees about killing dragons, but that is nearly not good enough to disappear for good without even visiting the place. Valka's dicision just does not make sense.<br/><br/>There are plenty other questions I have for this film, for example: Why is everyone okay with that Valka left for 20 years, if that is the only reason? Hiccup did not care at all (only surprised), Stoick sang together with Valka like nothing of that ever happened and the rest did not bother. Also why does Valka continuously act that she knows who Hiccup is after knowing him in about 2 days? Saying that being Chief is who Hiccup is, while the one thing that we know for sure in HTTYD is that Hiccup is an explorer rather than a leader. Astrid on the other hand was more capable to lead, so why does Hiccup not name Astrid as Chief? She could've been a great leader, but in this film she is rather a tag-along than an independent character and that is not Astrid I knew from HTTYD. Speaking of characters, Stoick died during the battle and surprisingly Drago just left Hiccup and the rest unharmed after he could finish them, but why? Shen from KFP 2 would not have taken any risks. He would have finished the job, if it wasn't for Po's counter ability with 'inner peace'. Also why did no one either spoke or mentioned Stoick again after the funeral, they just got over it? This is very rushed and forced writing at this point. In KFP 2 the story started very early with emotional investment with Po and his dad(Goose), that last through the entire film. So why didn't they start with at least one emotional gripping conversation between father and son that also last through the whole film to make his death more emotional and memorable?<br/><br/>In conclusion: The story of HTTYD 2 did not satisfy partly due to the pace. They went for a slow mysterious approach rather than a swift, dynamic pace like in KFP. The beginning was too slow in order to tell all there is and as a result we got a very rushed middle and end. In my eyes the seperate plots was a mistake. The choices of the characters Drago and Valka did not make sense. Astrid was not the real Astrid and the death of Stoick did not have anything memorable to it. I can only say that KFP 2 tells their both plots pretty clever. It had a clear direction and the story had a very compelling villain with an interesting goal and motive, but above all it made sense, along with improvement of certain characters with Po, his father and Tigress.
HTTYD 2 is not a bad film, but it has very questionable elements. Valka might had her reasons to leave the village. Drago might had his reasons to conquer Berk. But in this context they are just plot movers not actual characters with good motive. Hiccup's character arc(from explorer to leader) could be interesting, but it was unfortunately too little too late."
"Zxander","10","2","3","16 January 2017"," Best animation ever !
","I hardly have any words to describe this piece of art.I fell in love from the very first time i have watched it.The story is very amazing and satisfying and the animation art is so beautiful.The characters are very well chosen for this type of story.The film gives an introduction to the people and especially the young generation that the only beings that do harm and evil to anyone, even to themselves were the people and teaches us to be more kind to others and to respect the surrounding around us world that for me was quite enlightening to today's harsh world. Hardly recommend this to people who are dragon fans and not only.All i can say is great job Dream Works. Once again you bring happiness to the people around the world with your wonderful movies.My personal score 10/10 ! Can't wait for the next movie ! <3"
"oglehannah","10","2","3","21 October 2016"," Too many things to love, not enough characters to mention....
","What spurned this review is that I decided to wake up on my day off and watch both the 1st and 2nd movies. I meant for them to play in the background as I accomplished real work, but they sucked me in just like they do every time I watch them, so silly of me.<br/><br/>First off, I LOVED the 1st movie so I had high expectations for the sequel, especially after waiting so long for it to come out. And it didn't disappoint. I love that it's not just a children's movie, that it has values and ideals in it that resonate not only as a lesson for young children, but as something relatable for adults. The friendship between Hiccup and Toothless makes me tear up (which I almost never cry when watching movies). And you can watch this movie multiple times and see the many details added to the backgrounds of the main scene, like dragons messing with one another, etc. The music speaks to me...there are so many things that I'm sure I'm not mentioning, but I think you can understand I love pretty much everything about it based on my review.<br/><br/>My only spoiler is that I was very impressed with the scar on Hiccup's chin tying into the storyline regarding why he grew up without a mother. I didn't even notice it in the first film, and so I went home and watched the 1st movie again after watching the 2nd in theaters. Details like that make me want to go back and watch everything again to see if there are any other clues that may tie into the 3rd movie. My guess is that because we got Hiccup's background in the 2nd movie, we'll get Toothless' in the 3rd."
"Horst_In_Translation","8","2","3","2 January 2016"," The first was good, this one is great
","In 2010, there was an Oscar-nominated, animated movie called ""How to Train Your Dragon"". 4 years later, they made made a sequel after several short films and a television series had come out as well. This sequel went into Oscar night being the favorite in its category, but lost out nonetheless. In the first film, Hiccup and the gang had to understand dragons and it was not really about a true antagonist, even if there was one, a pretty big evil dragon that exploited other dragons. The only thing that one has similar with this film here is the gigantic dragon and in here there is even 2 and they are even bigger. But there is also a real antagonist this time. A scar-faced tough guy who treats dragons badly and wants to kill the tribe of our heroes. Luckily for them, there is also a new character that is a much more pleasant addition to the franchise. This character brings some true emotions to this film and I loved her scene with Hiccup's dad.<br/><br/>Talking about Hiccup's dad, he is certainly one of the main players again this time and the most significant scene of the film is all about him too. I will not go further into detail here. But I can say that I enjoyed the animation, the characters and the story in this one a lot. There is lots of drama, more than usual in animated films, but there is also lots of humour. The other young Berk inhabitants are pretty funny with their interactions. And so are their dragons frequently. The baby dragons playing around in the big one's face were really fun to watch. And there were many more hilarious scenes in this 100-minute movie. It runs slightly longer than the first, but only by a couple minutes. Both films include basically the same cast of voice actors with the exception of Djimon Hounsou, who voices the villain in this film here. No really big superstars, but some fairly decent names that have been prolific and experienced also in terms of live action movies and shows.<br/><br/>This was the second time I watched this film already. First time was in a theater briefly after it was released. The dragon flying sequences are certainly something you want to experience on the bis screen, but even if you do not have the opportunity to do so, these are truly mesmerizing. I saw that they already planned a third, but they are keeping the 4-year-break apparently, so it will not be released until over 2 years from now, in 2018. Writer and director will be Dean DeBlois again, who also made films 1 and 2. Will the Academy appreciate his efforts then finally? We shall see. Until then, make sure you have watched films 1 and 2. I am not the greatest dragons fan and I do not have great interest to watch the series (although maybe I will at some point), but I definitely had a great time with these two films, especially the sequel, which I highly recommend. Do not miss out on it."
"BoydudeReviews","10","2","3","15 January 2015"," FANSTASTIC Movie. Very grown up to the first one.
","This movie is set five years after the events from the first one. This movie is possibly the best animated movie of 2014 and one of my favorites of all time. The film has fantastic voice acting. The VFX is STUNNING. The storyline is gripping, trilling and exciting. There's a big TWIST in the movie that I did not expect at all. This movie is a MUST SEE for kids, teens, adults and the elderly.<br/><br/>REPEAT - This movie is set five years after the events from the first one. This movie is possibly the best animated movie of 2014 and one of my favorites of all time. The film has fantastic voice acting. The VFX is STUNNING. The storyline is gripping, trilling and exciting. There's a big TWIST in the movie that I did not expect at all. This movie is a MUST SEE for kids, teens, adults and the elderly"
"flblueeyedboy","10","2","3","6 January 2015"," An animated spectacle for the ages
","I have been a fan of the How to Train Your Dragon franchise since the first movie, and when I saw this movie for the first time... it was nothing I had ever seen before! Every component of the first movie was expanded and branched out upon. Their world has gotten bigger in every way possible. The colors, the characters, the conflict, the dragons... even the score has been expanded and improved to bring about a whole other dimension of their world! How to Train Your Dragon 2 is truly an animated juggernaut, and is something that nobody else will be able to upstage. It is possibly the most unique storyline of any animated film out there, and is a movie that the entire family can enjoy, from ages 8 to 98. Here's to you, Hiccup and Toothless!"
"thebrandedswordsman-34028","9","1","1","8 October 2019"," Glad to have you back, bud
","It's been a while since the first movie, and its sequel couldn't be any more pleasing. More often than not, the word ""sequel"" scares people, me included. But there's nothing to fear here, folks. This is a solid movie. The animation is better, there's more things going on in the story, more characters that are pretty likable, the music is literally epic, and it's funnier. Highly recommended.<br/><br/>9.4/10 (Amazing)"
"suhaibayub-59709","8","1","1","30 September 2019"," If happiness had wings
","Despite being a twenty year old living in the generation of movie lovers of Twilight and Transformers, How to Train Your Dragon tingles my senses every time I watch it. The bond that Hiccup and Toothless have is nothing short of a rare sight during a rapidly declining Hollywood era. From the marvelous skill John Powell shows to compose the score for this masterpiece, to the animation, to the simplicity yet purity of the plot, this franchise continues to inspire me, and many more."
"truemythmedia","8","1","1","20 May 2019"," A Very Solid Sequel
","This movie isn't as good as the original ""How to Train Your Dragon"", but you know what? It is far better than 75% of the other sequels I've seen. While this movie doesn't boast the same amount of fun and excitement as the first one, what it does have is expansive world building, great character development, some pretty cool action sequences, and a surprisingly emotional climax. No, it's not as good as the original, but it is an incredibly worthy sequel, and that right there is enough for me to sing praises for it.
I think the thing that I like most about this movie is that it is incredibly different than the original, while it still manages to maintains much of the magic that made the first movie so great. As the first movie ended with dragons being accepted into Berk, this movie starts when dragons have more or less been worked into every day life. The village of Berk feels new, while many of the things there are still the same. Similarly, Hiccup has changed; he's older, more mature. He's no longer dealing with feelings of isolation, now he's wrestling with a question of responsibility; he doesn't feel he's ready to become chief, despite what his father says. I really like this growth of the location as well as our protagonists. It feels as if the world has actually evolved, as if the events of the first film had forever changed Berk and the world around it, and that kind of gravity given to consequence makes all of the events in this film feel more important."
"noufnef","10","1","1","3 February 2019"," Super great
","I really mean this it's goooooood you have to watch it, I don't know about you guys but there's some minutes I almost cry, and other I couldn't stop smilingðŸ˜­ðŸ˜‚ðŸ˜‚ðŸ˜‚"
"TheMovieDiorama","9","1","1","28 January 2019"," How To Train Your Dragon 2 packs twice the amount of emotion and beautifully rendered dragon scales.
","When I said the first film caught me off guard with its surprising amount of intensity. Well, its sequel may have just bested it. From epic large scale battles on land, sea and air to investing character development between a broken family. This a near-perfect family adventure that is hands-down the best film from DreamWorks since 'Shrek 2'. Hiccup's village has now embraced dragons, and his thirst for exploration grows. Whilst venturing across the vast seas, he comes across an antagonising maniac who wants to conquer the world by controlling dragons. What this sequel does, which many fail to do, is mature the franchise. Hiccup and his viking friends are now young adults, and so their thought process and understanding of the world has matured with its audience. And I cannot understate how important that is. They could've easily replicated the original and played it safe, but evolving the characters through age allows more emotion to come through. The enamoured relationship between Hiccup and Toothless juxtaposes the fragmented bonds between Hiccup and his parents, and it works! It so works! And I found myself quickly becoming connected with every character and the tangible connections between them. Upon the arrival of the third act, DeBlois just puts everything on the table. Soaring dragon battles that lead to a sense of loss where Hiccup may actually not prevail. With so much at stake, you are automatically absorbed. The absolute gorgeous animation just complements the fantastical world that is presented. Lighting was improved, character models were smoother and the animation itself was divine. Improvements all round! Plenty of comic relief (particularly from Ruffnut) to ease the grandeur of its story and, well, packed with so much heart and sincerity that it often overwhelms. If it wasn't for Drago being underdeveloped as a villain, this may have got the perfect rating. Alas, it is an outstanding piece of animation from a series of high-flying films that came out of nowhere."
