"username","rating","helpful","total","date","title","review"
"morrison-dylan-fan","10","1","3","19 December 2015"," "" Oh it's fare thee well my darlin' true,I'm leavin' in the first hour of the morn.""
","With Christmas coming up,I started looking for a Bob Dylan related item to pick up as a gift for a family friend. Struggling to find something a bit obscure,I suddenly remembered hearing about an unreleased version of the Dylan song Farewell being included on the soundtrack to a title from auteur film makers the Coen brothers.Being enchanted by the soundtrack,I decided that it was the perfect time to pick up the DVD,and finally meet Llewyn Davis.<br/><br/>The plot-<br/><br/>New York 1961:<br/><br/>After the suicide of his singing partner Mike Timlin,Folk singer/songwriter Llewyn Davis has been struggling to gain a foothold in the business. Bringing his first solo album out,Davis begins to lose all his hopes as his album fails to sell.Keeping an eye on every cent he has,Davis sleeps on the couches of friends and former lovers.<br/><br/>Leaving a friends flat behind,Davis is left having to carry their cat around,when it escapes just before he locks himself out. Dragging the cat and his guitar around the music scene,Davis meets former lover Jean,who asks Davis if he can cover the cost of her having an abortion,due to Jean believing that Davis is the guy who impregnated her. As he goes to pay the doctor for the abortion,Davis begins to seriously think about leaving the Folk music scene behind altogether.<br/><br/>View on the film:<br/><br/>Before I get to the film,I have to mention the extraordinary soundtrack from T Bone Burnett,with prime cut Folk tracks from Dylan and Dave Van Rock being joined by elegantly performed new songs performed by the cast,which fit perfectly within the era of the film.<br/><br/>Sitting in the corner of every run down café and coffee shop,co- writers/co-directors Ethan and Joel Coen & cinematographer Bruno Delbonnel soak the movie in a rich, atmospheric darkness,which creates the striking impression of faded photos being bought to life.Not keeping the title solely confined to the clubs,the Coen's compose Davis fading music dream with a rustic chill,which subtlety goes against the family warmth that Davis and the other musicians present in their songs.<br/><br/>For the screenplay,the Coen's take an excellent Folk song structure,by connecting Davis moments of doubt/loss of direction with deliciously dry,witty detours. Taking inspiration from real life people in the music scene,the Coen's pave Davis path with delightfully off-beat characters who go from a tight-fisted manager to an ex who never forgets.Pressing down on Davis dreams,the Coen's send their singer off on wonderful misadventures,which goes from Davis having to deal with a musician who dies from a heroin overdose,to a cat ""changing sex"" without him noticing.<br/><br/>Delicately performing each of the songs,the eye-catching Carey Mulligan gives an excellent performance as Jean,who Mulligan stops from appearing brittle by giving Jean a perfect ""light touch"" in seeing Davis hit a dead end.Being stuck with only a cat for company,Oscar Isaac gives a fantastic performance as Llewyn Davis.Perfectly hitting every dead pan one-liner,Isaac crosses the comedic verses with a rough round the edges folksy charm,as the crowds in the coffee bars and cafes prepare to uncover the inside of Llewyn Davis."
"SquigglyCrunch","10","1","3","12 November 2015"," 'Beautiful' is the Only Word I Can Think of to Describe Inside Llewyn Davis
","I went into this movie unsure of what I'd think, considering I don't typically listen to folk music and considering the mixed reviews it received. I'm happy to say that it was absolutely amazing. <br/><br/>Inside Llewyn Davis doesn't have a particularly deep plot. It's about a folk singer trying to become famous. It's a pretty average music movie plot, which isn't a bad thing, especially in this case. The plot is very well carried out and realistic nonetheless. The choices Llewyn Davis makes feel more human than other movies I've seen, despite how hard they were to watch at times. <br/><br/>The characters are the driving force of this movie. Llewyn Davis is very well developed, and his character feels real and full of depth. Not everything that he says or references from his life will have major significance in his life later on, which really adds to it. The other characters are all amazing too, although I wish we could have spent more time with some of them. But just like real life, people come and go. There's not a lot we can do about that. <br/><br/>The music aspect of the movie was, although the overall plot, not as big as I thought it would be. Llewyn plays and watches other performances occasionally, but he doesn't do either very often. It's part of his character, but I kind of liked how there wasn't an excessive amount of music, despite the fact that I loved every song sung in the movie. <br/><br/>Overall Inside Llewyn Davis is amazing. With a well-done plot, fantastic characters, and great music, it's well worth anyone's time. If you didn't like it, then I really can't see why, but that's just your opinion. If you haven't seen it, then go do it. I highly recommend this movie to anyone, whether you like music or not."
"steve_plumber_man","3","1","3","20 July 2014"," An epic of what the pain of trying to be something great in this world can really feel like.
","Inside Llewyn Davis was for a fact, the most boring and uninteresting movie I have ever watched. The movie starts off with a bit of a hook, showing us the sad existence of a starving, couch surfing artist. But after the first 15 minutes it became incredibly difficult to set my smart-phone down. Nothing.... let me repeat, nothing of interest happens from here on out. <br/><br/>As time progresses, the movie grids to a halt. We start watching the grass grow as Llewyn comes to terms with the futility of his music career. There is even his lucky break, which he misses out on, foreshadowed as plain as day with no expert writing or development.<br/><br/>An orange cat's cameo tries to spice up the movie a few times throughout the movie (The three times I laughed in this movie had to do with the cat). And when Llewyn makes an attempt to head back to his normal career, he makes fun of his sick father and belittles his sister in front of his nephew. Oh yeah and through this cinematic lobotomy, Llewyn expresses what hes afraid of becoming if he leaves his glamorous life, to a real world career.<br/><br/>The rave reviews and the fact that this movie is receiving much acclaim has shown me how much politics are within the realm of Hollywood and its critics. This is the biggest disaster of my life, watching the Coen's epic of what the pain of trying to be something great in this world can really feel like. These are the kind of movies that make me want to put a gun to my head. (Not for real, but man this movie sucked) <br/><br/>The pathetic melancholy and sad, over played events of a dull life have been emphasized in this boring tale of how dreary life can look. So if that is your cup of tea, and you need to elevate yourself by finding grace in the viewing of others misery, please, watch this movie. After all, I have just had all worth while stories and epics I have viewed as of late, be shredded to pieces by this atrocity that some call a movie.<br/><br/>On the bright side I must admit the acting was A+ and the cinematography was very impressive. Every shot to me seemed to be cared for meticulously. It really did set the tone for the innate sadness and drudgery that lied ahead of every frame. But sadly, the screen play, the story, and the ending were just very badly designed and more plain than a box of macaroni and cheese.<br/><br/>For the meantime, I will eat an entire box of table salt in hopes I can re-stimulate the destroyed interest of my mind, body, and soul that have been removed from me in the operation of Inside Llewyn Davis."
"BrentAMG","10","1","3","23 January 2014"," Coen Brothers Will Be Remembered for Long Time.
","The Coen Brothers are stalwarts of the film industry. Since their first movie, Blood Simple., was released in 1984, the directing duo has rarely settled for anything but greatness. Most recently, the Coens wrote and directed Inside Llewyn Davis – a film about a week in the life of a struggling singer trying to create a name for himself in the Greenwich Village folk scene of 1961. Like many Coen collaborations, the film left some people nonplussed. Where was the resolution? It is a factor that some viewers – unenlightened ones, if I pretentiously do say so myself – find infuriating. Many of these films have similar threads running through them. Often, the familial filmmakers make noirs, a genre essentially extinct, save for mediocre attempts to revive it such as The Good German. The likes of Double Indemnity do not exist – at a high level, at least – in the modern era, except when the Coens decide it's time. Their works are paradoxical. At times, the gist will be clear: there is a God, or some higher being doling out justice. However, just as the viewer deems this to be true, Joel and Ethan throw some amalgam of existentialism and doubt into the mix. Wait, this isn't what I thought it was going to be, is it? This leaves the viewer to decipher what the meaning really is, if there is one. Another one of their trademarks is to include things that add absolutely nothing to the crux of the film. Don't read into the films too much, ya hear? <br/><br/>In Inside Llewyn Davis, the Coens reverted to what made O Brother such a success. Music and movies are the core of popular culture. In 2011, the two industries accounted for $17.5 billion. As a result, many musicals/ movies with music-themes do extremely well. Most recently, one should recall Disney's Frozen. However, there are those films that wade underneath the mainstream. Llewyn Davis is one of those films.<br/><br/>While Llewyn Davis was never as hyped as The Wolf of Wall Street or American Hustle, I believed it would garner some acclaim. I mean, it's the Coen brothers. Celebrated directors in their own right. True enough, many top critics have given the film solid marks. However, hoi polloi has not embraced the movie as warmly. Additionally, and unsurprisingly, the Academy failed to recognize the greatness of this folk tale about a folk singer.<br/><br/>Inside Llewyn Davis was nominated for two Oscars. Best Cinematography (Roger Deakins) and Best Sound Mixing. Exhilarating, right!? I take back the sarcasm for Deakins' sake. The man is responsible for some of the most beautiful displays of cinema in the past twenty years. The Shawshank Redemption, Fargo, No Country for Old Men, and Skyfall are a few examples. He's also worked on every Coen brothers' film since Barton Fink (1991). But, Sound Mixing? C'mon! Oscar Isaac deserved a nod for his soulful, back-breaking performance, Justin Timberlake and other writers for this little number, and the Coens proved their Oscar- worthy directing in the very first scene. The film opens with Llewyn Davis (Oscar Isaac) on a stage. Not a large one. Maybe, maybe 75 people watch and listen as Llewyn plucks his guitar and intones the lyrics ""Hang me, oh hang me. I'll be dead and gone. Wouldn't mind the hangin' but the layin' in the grave's so long, poor boy."" The entranced crowd slowly taps their feet, ashing their cigarettes on down beats, taking for granted the talent a paper plane's flight away. Davis continues his incantation while the mastery of the Coens ensues — I wouldn't be surprised if the seven other people in the theater thought we were watching the performance live. Seamlessly, the Coens transition from perspective to perspective, placing the viewer at the heart of the performance. A waitress walks by, blocks the camera as she passes, and moviegoers shift their heads to the left – as if it would actually change their view. First impressions may not be everything, but they count for a lot. The first scene left me enchanted.<br/><br/>The film would have failed without a talented actor at the helm. Ethan and Joel made no mistake in picking Oscar Isaac. He was able to embody the tortured artist, desperately wanting to be successful in playing his music while shooting himself in the foot the whole way. The film focuses on one tumultuous week in Llewyn's life. He lives in the moment, couch-to-couch, playing his guitar where he can. He has a couple friends, though he's not a great friend. He's prone to drink, lose his temper, and knock-up girls. His life is that of a rolling stone.<br/><br/>The Coen brothers have done much to advance the scope of cinema. Inside Llewyn Davis is no different. While it is under-appreciated now, I believe the picture will stand the test of time. Go see it. Thanks, Joel and Ethan."
"Maleplatypus","5","1","3","19 February 2014"," Yawn.
","I guess everyone expects a masterpiece from Coen brothers. In most cases it is true. This one, however, is not one of such. Story (story?) is pretty weak and I guess only an orange cat stands out. The main character does not. Now, to be honest, cinematography and cast performances are extraordinary. Coen brothers know how to make a movie, even if it is back-grounded with such a shallow story (story?). To me this movie has neither a beginning nor an end. It is just an excerpt from a life of a musician (and an orange cat). Long line of brief conversations and wandering around. Depressing at its best moments. Probably this would mean something to an American who was struggling to find his/her place on the stage in the depicted period, but to majority of the audience it's simply boring. Slow paced cat movie with some singing and guitar playing. Well made, though. Someone may even call it ""artistic"". But that's it. Nothing to write home about."
"jcbutthead86","10","1","3","7 February 2014"," An Excellent,Unforgettable And Funny Comedy-Drama From The Coen Brothers
","Inside Llewyn Davis is an excellent,unforgettable and funny Comedy-Drama that combines wonderful direction,a great cast,a fantastic script and a terrific soundtrack and with all of those element Inside Llewyn Davis is not only a great film but also The Coen Brothers at their best.<br/><br/>Set in the New York section of Greenwich Village in 1961,Inside Llewyn Davis tells the story of Llewyn Davis(Oscar Isaac),a Folk singer who is trying be a successful music artist while dealing with his own personal life taking him on an interesting journey of discovery about himself.<br/><br/>Inside Llewyn Davis is another amazing film from one of my favorite directors master filmmakers Joel and Ethan Coen AKA The Coen Brothers. The Coens have been on a roll delivering great film after great film the first film being their excellent Oscar winning Masterpiece No Country For Old Men(2007),their wonderful and very underrated Black Comedies Burn After Reading(2008)and A Serious Man(2009),the terrific Western remake True Grit(2010)and now Inside Llewyn Davis,an outstanding Comedy-Drama that is funny,intimate and The Coen Brothers delivering another incredible film to their body of work. Right from the beginning Inside Llewyn Davis is a sensational film that gives us a brilliant and at times quirky character study set in and around the Folk music scene in Greenwich Village New York with a movie that is simple but is still very engrossing and unforgettable because when you watch the film you are on the journey along with the main character. The Comedy and Humor in Inside Llewyn Davis is funny and weird and done in the style that is very much like the Coen Brothers using the characters and interactions with each to drive the Humor which is subtle and interesting. Although the movie is funny the Comedy has much more in common with A Serious Man then say Raising Arizona and The Big Lebowski. Another thing that I love about The Coen Brothers films and this movie as well is the amazing photography and attention to detail. The photography by Bruno Delbonnel is beautiful and visually stunning making the cold snow and winter look very bleak and isolating and at times surreal with harsh lighting that is dark and light. Also,The Coen Brothers' attention to detail and production design by Jess Goncher give the film a realistic look and truly takes you back to the year of 1961 whether it's in a bar,on the road or in a music studio you will feel like you are in the Folk music scene of 1961. The music scenes in ILD are exceptional and gives the film not only a great energy and tone but an accurate depiction of what the Folk music scene was like in the early 1960s and the performances by the actors feel true(it helps that actor Oscar Issac is a guitar player and singer in real life). You can now add Llewyn Davis to the gallery of great and memorable characters from The Coen Brothers films because like most of the other Coen Brothers characters Lleywn is a character looking to find himself in his surroundings and trying to figure out where to go whether it's dealing with trying to be a successful Folk musician or his personal life that at times can be funny and dramatic. And while Llewyn isn't always the most likable character has a depth that makes us relate to him because we are along with Llewyn on the journey he goes on. Llewyn Davis is a great Coen Brothers character that anchors the film and is a character you will never forget. The screenplay by The Coens is wonderful and memorable filled with great dialog mixing Comedy and Drama the only way The Coens can do. The ending of Inside Llewyn Davis is truly amazing because it makes ask questions about what happened throughout the film while leaving you with laughs,wonder and mystery. A terrific ending.<br/><br/>The cast is great. Oscar Isaac is excellent and memorable as Llewyn Davis,with Isaac bringing emotion and depth to the role. Carey Mulligan is terrific as Jean,Llewyn's ex-girlfriend. Justim Timberlake does a fine job in his small role as Jim,Jean's boyfriend. Coen Brothers regular John Goodman is wonderful as Roland Turner,a Jazz Musician. Garrett Hedlund is great as Johnny Five,a beat poet. F. Murray Abraham is great as Bud Grossman,a guy in the music business. Ethan Phillips(Mitch Gorfein),Robin Bartlett(Lillian Gorfein),Stark Sands(Troy Nelson),Adam Driver(Al Cody)and Max Casella(Pappi)give good performances as well.<br/><br/>The direction by Joel and Ethan Coen is amazing and stylish,with The Coen Brothers always moving the camera and bringing a beautiful visual style to the film. Wonderful direction by The Coens.<br/><br/>The soundtrack in Inside Llewyn Davis is fantastic with mostly Folk songs by Oscar Isaac and more. An outstanding soundtrack.<br/><br/>In final word,if you love The Coen Brothers or Folk Music,I highly suggest you see Inside Llewyn Davis,an excellent,unforgettable and funny Comedy-Drama that is The Coen Brothers at their best. Highly Recommended. 10/10."
"shawneofthedead","8","1","3","16 January 2014"," Never has an elegy been so full of life, incident and gentle, comic tragedy.
","In a movie industry that encourages simplicity and accessibility, the Coen brothers and their almost uniformly excellent, resolutely quirky films have always set themselves apart. Where most other directors and writers would celebrate the triumph of the human spirit, Joel and Ethan Coen craft movies that practically take delight in the futility of human endeavour. Life and its attendant twists and turns, their oddly-named characters discover, just happen to you, however you might try to dictate your own terms. Even their fizziest of comedies have a darker soul buried beneath the laughs.<br/><br/>In much the same vein, Inside Llewyn Davis defies easy categorisation. It's ostensibly about the titular Llewyn Davis (Oscar Isaac), a struggling folk singer who couch-surfs across New York to avoid sleeping on the streets. For the week in his life that the camera stays with him, Llewyn is hunting for the cat that slipped out of his grasp when he was staying with the wealthy, Jewish Gorfeins (Ethan Phillips and Robin Bartlett). Along the way, he tries to ply his trade, hunting down a job opportunity in Chicago that might free him from his stints at the tiny, smoky Gaslight Café tucked inside New York's bustling Greenwich Village.<br/><br/>Tucked away within the meandering narrative, however, is a soulful meditation on the fickle nature of fate, fame and fortune. Frequently, movies and well-meaning mentors tell us that we are the architects of our own success: if we want something badly enough, if we're talented and work hard, the universe will provide us with a happy ending.<br/><br/>The tragic folk ballad that is Llewyn Davis, the hapless anti-hero of his own life story, tells us something quite different. Here is someone enormously gifted - this would be a different film entirely if Llewyn only thought he was a good singer - who has never managed to grab onto the spotlight when it flickers over him. He shares it, briefly, with singers who will go on to do far greater things than him. (Watch out for the iconic tousled mane and harmonica of the man who will soon change the face of folk - and popular - music forever.) Money, fame and joy seem to elude Llewyn at every turn, despite (and sometimes due to) his best efforts to get by.<br/><br/>Inside Llewyn Davis also works as both road trip and character study. As we travel with Llewyn from Manhattan's classy Upper West Side to the narrow, boxed-in apartment of his best friend Jim (Justin Timberlake), we get a peek into Llewyn's tenuous relationships, even the best of which are wrung dry of favours and predicated on lies. In an almost callous way, he fights with Jean (Carey Mulligan), Jim's girlfriend, over an indiscretion, and in the next breath, lunges desperately after a cat that bears a passing resemblance to the one he lost.<br/><br/>Llewyn's determination to do whatever it takes to get noticed - to get a job - also underscores the surreal road trip he endures to Chicago. This is perhaps the most characteristically Coenesque stretch of the entire film, the black humour played with a twist of sarcasm and irony as Llewyn is trapped in the car with his fellow passengers. He must suffer the derision of pushy jazz musician Roland Turner (John Goodman) and the casual disinterest of beat poet Johnny Five (Garrett Hedlund), until circumstances - odd as they inevitably are in a Coen film - separate them all again.<br/><br/>The performances in the film are, in a word, sublime. A struggling actor for many years, Isaac must have seen the parallels between Llewyn's story and his own. This is his moment in the limelight, however, and he knows it. Isaac plays the highs and lows of the Coen brothers' melancholic script with marvellous self-assurance, and is hauntingly note-perfect in the songs and stories he spins for unappreciative audience members. Mulligan, Timberlake and Goodman all deliver memorable supporting turns, the first two even contributing a beautifully-harmonised rendition of Five Hundred Miles (with Stark Sands) to the soundtrack.<br/><br/>Anyone looking for the same oddball dynamics and sensibilities that the Coen brothers have honed to a fine precision in films like Fargo and No Country For Old Men should take heed: Inside Llewyn Davis is made of gentler, subtler stuff. It's a snow-washed blend of amusing drama and bitter comedy, played at half the tempo of the Coens' more frenetic output. As such, it might appear languid, and even a bit lifeless on a first viewing. But it's that rare kind of film which lodges itself firmly in the heart - or perhaps the soul - as it makes the most melancholic, magical music for a man who's slipped between the cracks."
"vibha101","7","1","3","13 January 2014"," Inside Llewyn Davis embodies immense soul and spirit
","I wasn't sure what to expect prior to watching Inside Llewyn Davis, but I was definitely impressed afterwards. Inside Llewyn Davis is one of those films with many grey areas and a lot of depth and sincerity to it. Llewyn Davis's character was extremely soulful and through his music he constantly conveyed a variety of different emotions ranging from sorrow, hope, defeat and compassion. One thing I found very striking in this film was its cyclical nature. The movie began and ended with extremely similar scenes with very minute differences in each. This shows us the difficulties that he had to face over and over as a struggling musician during the 1960s. This cinematic element reminded me of the film ""Before the Rain"" that began and ended the same way, where the characters were unable to escape their circumstances. Similarly, Llewyn Davis cannot escape the harshness of the current world he lives in where it is extremely difficult for a struggling musician to survive. It leaves you with a sense of ambiguity but also shows more about the character of Llewyn Davis and how true he is to his music. Unlike other characters in his film, he does not succumb to music or ways that are not a representative of his soul and who he is. Llewyn Davis expresses various emotions through his music regarding some of his life events such as his partners suicide and the birth of a child he had no idea about. This is what makes his character and his music heart wrenching and soulful. I think this film is more about Llewyn Davis rather than his life events. Overall my expectations for this film had been surpassed and I am extremely glad I went to watch it. It was thoughtful, filled with emotion and beautifully executed."
