"username","rating","helpful","total","date","title","review"
"Rickting","6","2","5","7 September 2016"," What just happened?
","I do not know what to say or think. Crude sex jokes. Endless profanity. Violence. Drugs. Movie references. Nazi jokes. Racial stereotypes. Anti-religion metaphors. Vulgarity. And most memorably of all, a food orgy. Those are the elements that make up this shocking animated movie, where supermarket food items discover that humans aren't gods taking them to the 'Great Beyond', but are actually going to eat them. This one features a huge amount of swearing, tones of puerile and offensive jokes and it's by a studio and director best known for making Thomas the Tank Engine. You have to see this one. Sausage Party works well in some ways but not in others. It's a very clever and thought- provoking film, and its metaphors and social commentary are shockingly clever. The trouble is... it's not actually that funny. Essentially, it's like a group of 5 year olds saying rude words to make each other laugh. It's far too reliant on crude dialogue and sexual jokes, and it sags massively in the middle. However, the storyline remains interesting even if it's not that funny, and the food orgy at the end is something you will never forget. Someone in my screening said out loud ""That is the most bizarre thing I've ever seen in my life"". That should be a fairly standard reaction to this film. It's nuts. It's uneven. It's bonkers. It's definitely one to watch, to see for yourself what you think. Even if you don't like it, you won't forget it. <br/><br/>6/10"
"uhuhuijoi","4","4","14","27 August 2016"," A pretty good movie ruined by a blatant anti-religion message
","(Bear with me here and don't downvote this just because you disagree with the title)<br/><br/>In terms of comedy, this movie was good. It was gruesome, but that was funny and occasionally done to perfection. Aside from the humor, I strongly disliked some of the messages this movie sent. I agree with the ""have fun and live your life"", but the religious overtones were done horribly. The sausage says there's no proof of God's existence (and I get that this is a comedy that pokes fun at society) but the writers completely ignore that fact that nothing disproves God's existence either. I'd argue that just the fact that we're here suggests that something created us. I think my biggest complaint about Sausage Party is that it depicts people who believe in God as stupid or in denial of what's wrong with the world- as people who choose to believe that God exists because they don't want to bear the ""truth""- and I think that's disrespectful and just stupid. I get that the writers are trying to make fun of society, but they blatantly disrespect the very large portion of the population that believes in God and has concrete reasons to. I fully respect atheists and agnostics, but I just can't help but notice that this movie felt like it's purpose was to push Rogen's anti-religion agenda but add some fantastic humor to try and make it less noticeable, and that just rubbed me the wrong way. I'm not a conspiracy theorist or some lunatic that believes everything they hear, and I hope I don't come off as one, but the fact that this movie has such a blatant anti-religion message just ruined the humor for me. Thank God that this wasn't a kids movie- I wouldn't want to bring my children to watch this and then have them come out semi-brainwashed by the overall theme. I agree that you should have fun with your life, but that doesn't mean having sex with everyone all the time, using drugs, and not caring at all about yourself besides your sexual desires.<br/><br/>PS: Although it was a bit unnecessary, that food orgy at the end was hysterical."
"Pozdnyshev","4","4","14","23 August 2016"," Reinforces A Crappy View Of Humanity
","this is yet another Bread & Circuses type of movie where whatever crass and lowest-common-denominator attitudes and values held by most 12-40-year-olds are put in a blender and regurgitated. This time it's in the form of a dippy-ass animated story about supermarket food. Specifically, the love story between a hot dog and a hot dog bun. Oh, brother.<br/><br/>Why does everything in Hollywood have to be so damned gay now? And I don't mean ""gay"" in a homosexual-bashing kind of way, necessarily (though I am sick of seeing homosexuality being put on a pedestal; I get it, some people are freaks, shut up!). I mean ""gay"" in a ""banal, immature, and stupid"" kind of way. The biggest ""joke"" in this movie is how the men are represented by hot dogs, and the women are hot dog buns. Huh huh huh how clever HAHAHA the hot dogs are penises, and the buns are vaginas HAHAHA holy sh*t go kill yourself.<br/><br/>This is a propaganda movie that just vomits a nihilistic, crappy view of humanity in our faces. I'll save you the trouble: -sophistication means watching an animated movie with cuss words in it -belief in God is unconditionally backwards -recreational drug use is acceptable -sexual immorality has no consequences -homosexuality is acceptable and not weird or inappropriate, ever -humans are little more than their reproductive organs, -profane horse-sht makes a good movie because we're, like, breaking the rules.<br/><br/>I remember when I was young and thought that Atheism and Subjectivism was the neatest thing in the whole world. Then I grew up and realized that they are mostly very juvenile ideologies that have such mass appeal only because they provide a compelling rationalization for unconditional selfishness. Yeah boo God and absolute morality... retards.<br/><br/>I'll say it now. I don't like most young people because they are the kinds of shallow-minded idiots who watch and enjoy crap like this. They bitch about how religion is brainwashing, but then they totally see the media as a religion. They never use their minds to question the f@ggot-assed bilge being foisted on them by ""entertainment"" like this.<br/><br/>This is propaganda. Good propaganda, but one that serves to kind of keep people in a state of suspended adolescence.<br/><br/>It looked pretty good, though."
"Oneirosophos","10","3","10","31 October 2016"," A modern Aristophanic comedy!
","I had great expectations for this movie, since I watched the very first trailer. It seemed to be something fresh and clever! Not another animation with talking animals. Then the reviews came. A major success. That frightened me. Like a lot. Major success does not mean a good film. Frozen was terrible.<br/><br/>So, I gathered all of my friends and went to watch it together. Each one has different taste but we all like a good animation. And it was a TRIUMPH.<br/><br/>This movie is an awesome comedy of epic proportions, for 15+ people! Everyone that is complaining for vulgar content belongs to the braindead who went with their kids to watch Deadpool. THEY ARE RATED FOR A REASON, PEOPLE!<br/><br/>The main theme of this movie, is not a food story, but more than this. It's an animated, Aristophanic comedy, of the modern global society, in almost every level. A sharp and clever criticism to the mindless mass. A challenge to read under every surface. And all these, from a seemingly harmless animation with food starring!<br/><br/>Just enjoy it! A rare diamond of animated films!"
"mohamedghareeb-13417","2","3","10","24 October 2016"," Too much time wasted for nothing!!!
","Poor story ,Bad Ending poorly written, directed, and acted While it starts out with a nice concept and rolls out with promise by half way into the movie you are just left with bad clichÃ©s and poorly written dialog and script. The movie lacks any real tension, any climax, any action.<br/><br/>I don't know why Seth Rogen always mentioning in all his movies that he is Jewish !!!!!!!!<br/><br/>Important subject matter is no reason to overlook bad film making.<br/><br/>The only thing that is not disappointing with this movie is the constant way it's falling apart. From a seemingly promising beginning, it goes there on a downward slope to an ending that is the one of a Scooby Doo cartoon"
"profsmichael","3","3","10","24 October 2016"," R-rated 13-Year-Olds
","While technically funny in places.... this is really just a sex, gay, or stoner gag: one after another for an hour and a half! <br/><br/>Seriously wears very thin after 30 minutes or so.<br/><br/>Unfortunately this gets the distinction for ""first R rated CGI Animated Feature Film"". It may just kill the genre before it starts.<br/><br/>Really good opening weekend for a sub 20 million title. Made a profit, so there will be more of this.<br/><br/>Seth, Jonah, and Evan are without a doubt: the OLDEST 13 year-old kids I have ever heard of. Guys, you are funny, but seriously? Gag after gag is not a movie."
"davelynch16","2","3","10","21 October 2016"," Unfunny, Pointless and downright boring.
","I was looking forward to seeing this. I figured it would be nice to see an animated movie aimed at adults. It's long overdue. I have nothing against many of the latest movies form Pixar. I liked Ice Age and The Minions they were very funny movies with a clever script.<br/><br/>Sausage Party however is neither funny or clever. Simply having cartoon characters swearing for the sake of it does not make it funny. It is possible to this kind of humour well as shown in Family Guy which has a cleverly written script and if you watch the unrated DVD's the occasional F word.<br/><br/>Sausage Party is simply bad language and nothing more. The story is silly, Although silly movies can still work as entertainment, this movie does not contain anything clever or amusing. I have given it two instead of 1 as I did almost laugh at the food orgy scene."
"danielharden","4","3","10","17 September 2016"," Sausage Out For Harambe
","Sausage Party is the newest addition to the ""Animated Movies For Adults That People Mistook Was For Kids"" list that includes films like Team America and literally every animated movie above a PG rating. With a cast filled with funny comedic actors (and Edward Nortan), this toy story like film about food items journeying to discover the truth of the ""great beyond"", should be a laugh a minute... But sadly the cute cartoons doing and saying R rated things gets old really fast.<br/><br/>The main issue with Sausage Party is that I don't know if it tried too hard or didn't try hard enough. The film completely overuses its profanity especially the F bomb which in tern weakens the impact of the word both in shock value comedy and as an insult of any kind. The dialogue is basically what you would expect to hear in a Call Of Duty lobby on xbox, a barrage of nonsensical swearing that's only funny due to how completely pathetic it is. The film also heavily overuses food sex jokes and puns which, like swearing, is funny in moderation... Not every God damn sentence. Also the puns aren't exactly original or creative, some of them are but when the film is 89 minutes of food sex puns not every joke is going to work. Also may I add the food orgy scene at the end wasn't funny its just traumatising.<br/><br/>What I did find interesting though with this film was its symbolic approach to homosexuality and religion... OK the homosexuality implications became less than subtle as the film went along and ended up a little disturbing just like the rest of the film, but the religion metaphor was good. ""The great beyond"" being the food version heaven and the humans being... well... God's, as the food refer to them as.... OK nothing about this film is subtle I'll just admit this now. For me it isn't the symbol of religion that I liked, SPOILER ALERT, it was when Frank confronts and questions the food belief and how this as well in a way challenges Christianity in both their belief of a God and heaven as well as their beliefs of homosexuality. This to me is the redeeming quality as I liked how the film had an underlining meaning that, although not executed brilliantly, still got me thinking.<br/><br/>Overall, Sausage Party is a mentally scarring animated picture that attempts to make a statement about religion and homosexuality. It completely overuses the humour of watching a cartoon swear and have disturbing CGI sex but some jokes are actually quite funny. Is it as good as other animated films for adults like Team America? No, but I would say its worth a watch.... Just don't bring your kids along... Unless they play a lot of xbox"
"Whingewood","4","3","10","2 September 2016"," To use their vernacular, ""f*****g spooge!""
","Personally, I have found Seth Rogen's previous efforts to be very hit and miss. I quite liked The Green Hornet, but absolutely hated This is the End.<br/><br/>With a title like Sausage Party, my expectations weren't set high. Just as well really, as it was extremely lowbrow (which isn't necessarily a bad thing). but unlike Matt Stone and Trey Parker efforts (South Park & Team America), it offered little in the way of intelligent commentary to counterbalance it.<br/><br/>I know that humour is subjective, but to me this wasn't funny. I'm not even sure that my twelve-year-old self would have found it funny. If you find animated food saying f**k and c**t amusing, then this is the film for you. For everyone else, spend your ticket money elsewhere.<br/><br/>The film's 'message' was not smart or original, and their attempt at shock factor (""haha, that vegetable said f**k!"") fails because it's been done before, bigger, longer, and uncut (South Park movie).<br/><br/>(Originally published on my blog, whingewood.wordpress.com)"
"ybenhayun","4","3","10","22 August 2016"," Funny, but not nearly as funny as I wanted it to be
","The biggest problem that I had with this movie is that while there were plenty of jokes that landed, they were few and far in between for much of the movie. There are big stretches of the film where characters are saying really shocking and raunchy things, but none of them got laughs. It would essentially feel like I was watching a hot dog and a bun just talk about sex in really grave detail, and when it wasn't funny, it just kinda felt weird to watch. It takes up until the last 20 minutes of the movie for it to be consistently funny, and when it got there I was laughing pretty much non stop until the end, but up until then it would be like a laugh every now and again. The jokes that do land are really funny, and this movie is incredibly creative and clever in a lot of different ways, and I think the way they depicted food being killed was genuinely hilarious, but if you're going to make a film this raunchy and dirty it needs to be hilarious through and through, otherwise it just comes off as immature and stupid, which is how a lot of the film felt to me."
"RforFilm","5","3","11","15 August 2016"," Sausage Party has it's delicious moments, even if the crass novelty becomes repetitive
","Animation has the ability to give live to things that we previously would have never considered. Disney and Pixar in particular have brought cars, toys, rats, bugs, fish, and robots a humanized life and a study on what their purpose is, now with thoughts and feelings. There's a magic within that, so it's not uncommon for other things we could explore to see what their perspective of the world would be like. For toys in Toy Story, it's a joy land of children and imagination, but with a dark side of childhood eventually ending. For bugs in A Bugs Life, it's more of a survival of the fittest as their several kinds of insects out there. How about food?<br/><br/>Today's movie shows that food may have the worst when it comes to their purpose. Writer and actor Seth Rogan not only wanted to explore what that world of humanized food would be like, but to do in his adult context. R rated animated movies are a rarity, but it's nice to see a studio like Sony take a chance on a risk. You could even argue that because adult cartoons are more popular on television now, R rated animated films could have a bigger opportunity. Let's see if Sausage Party invoke more adult animated stories. <br/><br/>In a market called ""Shopwells"", each morning opens with the food signing (it's made clear in the beginning that people cannot see them move or talk) about their desire to be chosen by the ""gods"" to be taken out of the store into the ""Great Beyond"". One area with all the forth of July food, contains sausages and buns. One sausage, Frank (played by Seth Rogan), along with Carl (played by Jonah Hill) and Barry (played by Michael Cera) are hoping to be chosen with a set of buns next to them, which contains Frank's girlfriend, Brenda (played by Kristen Wiig).<br/><br/>When a jar of honey mustard commits suicide, this causes the shopping cart where the sausages and buns were chosen to collapse. This causes Frank and Brenda to slip out of their packaging, leaving them behind in the store while everyone else goes to the ""Great Beyond"". Frank and Brenda are told to go to a set of imperishable foods to learn the truth about their existence. Along the way, they encounter a taco lesbian Teresa (played by Selma Hayek), a Jewish bagel Sammy Bagel Jr (played by Edward Nortin) and bottle of Liquor Firewater (played by Bill Hader).<br/><br/>I cannot stress enough of how important it is to understand that Sausage Party is not for children. I'm twenty-nine and I'm not old enough for this. I'm not even sure if my parents are old enough for this. There is so much swearing, violence, and sexual content (including a three minute food orgy somewhere), that Sausage Party has earned it's R rating and them some. Within all the crass is a well-written script that is sort of an analogy to real life religion. While I wouldn't call this movie an atheist story, I can understand that many people would be turned off.<br/><br/>I can defiantly say it's a smart script, though I'll admit that the constant crass does wear off after a while. It's funny, but when your dialogue is almost nothing but swears, it makes for a repetitive attitude that I doubt the film is aware of. Story wise, it does feel a little stretched (and this is an eighty minute movie). Part of me thinks this might have worked better as an hour long special on Netflix, but you can still tell by the number of comedians in this along with some great animation that Sausage Party has it's moments.<br/><br/>I'll give this five hot dog sausages out of ten. Sausage Party is an acquired taste movie, and though I might watch it once more, I can see a lot of people playing this at parties. Speaking of which, Sausage Party is an ADULT PARTY ONLY. LEAVE THE KIDS AT HOME!"
"terimcnally","1","2","6","30 September 2019"," WORST (Vomit)
","Thought it would be funny but had a bad feeling based on the title. Critic reviews were high so I took a chance. What a waste of time! :-(( Nothing but TRASH! Don't waste your time. Go watch some paint dry.
That would be more entertaining"
"rickraptor707","1","2","6","14 December 2018"," One of, if not THE worst movie ever made!
","This film is absolute cinematic garbage. Worse than that, ""garbage"" isn't even a strong enough word to describe this abomination. This ""film"" feels like they took a concept that could work as a YouTube short, stretched it out to feature length, and crammed it full of profanity and remarkably unfunny sex jokes.<br/><br/>The fact that this film was greenlit is a crime against humanity. I would give this thing zero stars if I could. More than that I'd give it NEGATIVE stars if I could!<br/><br/>This cinematic abomination has a decent concept, but it's so poorly executed that it resulted in an unfunny, overly vulgar, and all around unbearable 90 minutes.<br/><br/>Foodfight, the Emoji Movie, and Troll 2, are all better than this pile of filth. If I could destroy every copy of this film in existence, I wouldn't even think twice about it.<br/><br/>Do yourself a favor and give this film a pass. It doesn't deserve your attention, and you deserve better than this"
"sanahassan","1","2","6","26 August 2018"," The rape scene just did it for me!
","Terrible plot! Terrible humour! Brainless comedy with very offensive scenes. Especially the graphic rape scene!! How is rape of a helpless juice box entertaining? I was so shocked and upset at that point that the it just stuck with me throughout the movie..
Plus the ending was horribleeeeee with the stupid food sex orgy that goes on for 5 mins!"
"fineas_2005","1","2","6","24 May 2018"," Worst animation idea for children
","This should be +18 movie, what are you trying to do to our kids?? You sack of empty brains. Total fail are these movie makers in this world"
"mikie-62667","1","2","6","8 March 2017"," terrible
","I've never felt the need to go online and review a movie until I've seen this, literally the worst movie I've ever watched and a waste of my time .F you Seth Rogan your career ended 10 years ago.i cannot stress this enough, I mean half the movie was cartoons having sex , what a waste of my breath just to watch this I wish I could slap the directors.<br/><br/>terrible"
"anandrajeev979","7","2","6","21 October 2016"," A Greatly Funny Animated Venture(mostly about sex) but Highly Divisive
","I wanted to give it a 9 But I gave it a 7. First of all its a great R rated comedy and more often its a great animated movie. Its actually a breakthrough in my opinion so different from the common animated movies we are used to.The Concept is Great and very well executed. This animated is not for children with over 150 uses of 'f' word. The whole movie is funny , some comic moments stand up from the rest as they are very well executed.Script is funny and my God all the Characters are Hilarious.In this way if you love a dark comedy which includes sex references and foods killing people and performing various sexual acts on each other , its a good movie but on the other hand it feels a little too much and that's why I could not go with a 9 but I gave a 7.At many points I felt all the sex jokes were a little too much .Even then I loved the movie as how it throw so many ironies .I loved the Characters of Taco , Bun , Sausage, and Most Importantly Gum.Its also political in its own right which I suggest is bad.Honestly I could easily compare it with The Wolf of Wall Street but just a little less silly and way more more funnier.Still As an R Rated Comedy it does what it should do , it will make you burst out with laughter only if you consider the jokes as funny and not gross. That's why its Highly Divisive , you will either love it or hate it But I do am sure it may nag Oscar Nomination for Best Animated Feature.."
"gnarlycharlie34","10","2","6","19 September 2016"," One of the smartest, funniest and most disgusting films I have ever seen!
","The main aim of a comedy is to try and make the audience laugh. Well, this film certainly did that! I saw this at the cinema and I can't remember the last time I heard such loud roars of laughter throughout the entirety of a film. It is a witty, smart and ludicrous film that works perfectly. Each character is brilliantly thought out and they all fit together which makes the story very engaging. <br/><br/>It goes without saying that if you are already a fan of Seth Rogen's style of comedy you should absolutely love this. In addition, there are various actors in this film who have previously worked with Seth Rogen which makes it even more enjoyable and gives it that edge. I won't mention names though as it is quite fun trying to work out who is doing the voice for each character. <br/><br/>The film is super offensive and in some parts disgusting but if that's what it takes to make a comedy masterpiece then so be it! I have no problem with the content of the film and I love a bit of shock value but I do understand some people will be offended because people are people and people suck. <br/><br/>Seth Rogen has proved once again that he is a stoner genius who knows how to write, act and truly make people laugh. As soon as the film is released on DVD I will be buying it so I can watch it over and over again!"
"antnbee-gm","10","1","2","21 May 2019"," My face hurts!
","I don't understand the low ratings people have given this movie as I have serious face-ache after laughing so hard. Seriously bent!"
"chessemill-303-756775","9","1","2","7 November 2018"," No haters
","Let's get realistic here what did you expect from this movie?
From the minds that gave us this movie it's fairly obvious where it was going. The movie was fantastically funny. The bath salt seems alone was enough to buy the ticket. And if you bought the ticket you might as well take the ride."
"jack_andrew_c","4","1","2","24 October 2018"," it was so so...
","This film was not great at all! i don't think it should get a one or two stars. that animation team did a great job and Seth Rogan had some funny moments but i really wouldn't pay money to watch this! i only recommend to 18 year old stoners with very little taste in entertainment."
