"username","rating","helpful","total","date","title","review"
"ArthvrPendrag0n","10","1","1","13 May 2020"," I love this movie.
","The Fifth Element is a movie I've watched without any big expectations, I honestly thought it would be the average sci-fi movie with a bit of action here and there. Turns out the movie actually is what I expected, but the execution is simply entrancing - it has good action, it has sci-fi elements and it somehow found a window to add comedy and romance, how can I not like this movie?<br/><br/>The story itself is quite simple. We know there is a evil that appears every 5000 years and threatens to destroy all life, but this very evil is repelled by a good force in the figure of a supreme being - a being that channels powers from four stones, each one representing one element, to create a light that disperses evil.
The whole plot revolves around securing the stones and executing the ritual that will destroy evil. The story really starts when Leeloo, the fifth element, is rescued by Korben, a cab driver with a dry sense of humor. At first he doesn't really understands what's going on, but decides to just jump on it against all possible logic. He takes her to a priest, the one who knows the whole scheme of things going on. However, the stones, that are necessary for unlocking the power to defeat the shadow that draws closer to the earth, are nowhere to be found. We're then introduced to Zorg, some sort of megalomaniacal minion working for the evil forces - he initially tried to steal the stones, but the mercenaries he hired retrieved only an empty package. Zorg apparently executes them for their failure - but they eventually come back to get their revenge. Meanwhile the government knowing the existence of the stones want to put Korben back into action because he's the last living member of an elite force. Once the locations of the stones is revealed, they all eventually set course to the same destination - Korben and Leeloo embark in a quest to save the world, while all the other characters find a way to fit in the action.<br/><br/>What really makes the dots connect are the characters, they're all so very satisfying to see in action - there's the tough guy who is a reluctant hero, there's the priest who serves as intellectual mentor when he's not in trouble, there's the comic relief guy who turns out to be more useful than initially thought, there's the evil guys and their mannerisms, and of course there's the being that brings them all together. It doesn't matter that the plot is simple, considering that it's explained right in the beginning , the experience is thrilling from the start to the end - you're never really sure when things are taking a turn for better or for worse, it's chaotic in a perfect manner. I really love the characters interactions, even the bad guys are charismatic in their own way; the twists are very well placed and never really break the logic or the atmosphere of the movie. Eventually the good ending is delivered, but until it gets to that point every moment is so entertaining - the pacing is just perfect, it's fast but it is rushed.<br/><br/>Korben (Bruce Willlis) is a good main character, his sully remarks are often funny and contrast well with the personalities of other characters - it's really funny to watch him and Ruby Rhod (Chris Tucker) together. He's the action man, but he's quite sweet when he interacts with Leeloo - which builds the romance part of the story; the dynamic between them is really good, he's the one who seems to understand her better than the others and he knows what she must do and how he must help her, but I really appreciate the fact that this doesn't stand in the way for a subtle development of a love affair - and more than anything I'm glad the romance between them is not something forced. Zorg is the typical supervillain, from his arrogance to his appearance - but Gary Oldman plays him so very well, he surely has memorable moments. Ruby Rhod is so damn funny, whenever he says something I can't help but laugh - he's so over the top, but he fits so well - he's truly a memorable character. But my favourite character here gotta be Leeloo, she doesn't say too many lines we can understand, she mostly speaks in a broken english when she can put some words together, but she's so expressive - she's strong, she's the fifth element, but she really shines when she is expressing human emotions - gotta praise Milla Jovovich for playing her so well, she's gorgeous.<br/><br/>The way I see it the plot is imaginative, but simple. The simplicity adds a dimension for developing many other points that build a movie - the characters, the atmosphere, the execution; if anything, it is a take on sci-fi that is not much common. It's more than a sci-fi movie, there's good action, there's some really well placed funny scenes and there is emotional development that ends up in a satisfying manner - there is a good ending and it's satisfying. It's hard for a movie to do so much and succeed, but this movie does it and I honestly feel like it is a bit underrated. I like to see the clash between good and evil, I like when it's done well and more than anything I love happy endings. So much replay value, 10/10.<br/><br/>P.S. Éric Serra's score is just marvelous, it is a important part of the experience and it's really a gem. It functions so well in creating tension and helping dictate the pace of the action sequences. It's really a element of the movie that shines for me, I think without it the experience would be really affected."
"alexadriansmith","10","1","1","14 April 2020"," Better and Better and Better
","I saw this at the cinema when it first came out and its still just as good if not better. How I love a good 90s sci fi and in many ways, they still surpass sci-fi films of the 2010s and now 2020s. It was a golden age of great offbeat cinema but I wonder if distributors would even have the balls to show films as good as this now? Bruce is just awesome and Mila, what an actor. The music gets me every time 'Super Green'."
"MaximumMadness","10","1","1","23 February 2020"," ""The Fifth Element""- Inventive and entertaining start-to-finish!
","Good old popcorn movies. They never go out of style! They're the perfect remedy to pop on after a long week at work or on a boring rainy afternoon. Something to sit back, relax and enjoy. And director Luc Besson's 1997 sci-fi action/comedy epic ""The Fifth Element"" may just be one of the all-time greats! A film that is endlessly inventive and entertaining from the first frame to the last.<br/><br/>In the distant future of 2263, a dark and mysterious force emerges that threatens to destroy all life as we know it. And the only thing that can stop it is an ancient weapon that combines the elements of fire, wind, water and earth with a living being- a ""fifth element""- to channel them. And that fifth element? A peculiar and beautiful alien clone called ""Leeloo"" (Milla Jovovich), who must team up with a special-forces-agent-turned-cab-driver (Bruce Willis), a sagely monk (Ian Holm) and a fast-talking talk-show host (Christ Tucker) to save the universe!<br/><br/>It's hard to believe that ""The Fifth Element"" will soon be going on twenty-five years old. Because for all intents and purpose... it's as refreshing and fun as it ever has been. The film benefits from a wonderful cast, a great tone and a deliciously over-the-top style that sets it apart from others that came both before and after.<br/><br/>While Bruce Willis is definitely the headliner in the cast, there isn't enough that can be said about how wonderful Milla Jovovich is in the part of Leeloo. She is the beating heart of the film. She is fearless and charming, and can also kick some serious butt when needed. This is the film that made her a star, and she's just fabulous. Not that it takes anything away from the rest of the cast, though. Because they're just as good. Willis is a blast as usual, with his smart-alec nature and penchant for action, and he lends a lot to the proceedings. Holm brings a sense of class and dignity, and even gets some sharp comedic moments to sink his teeth into. And I know he's divisive in this film... but I friggin' love Chris Tucker as the obnoxious and hilarious Ruby Rhod. He's just a ton of fun. Special props also go to the always-reliable Gary Oldman as Zorg, one of the film's main villains. He's great in the part and brings a lot of life to the proceedings.<br/><br/>I also really love the tone Besson establishes in the film. There's a lot of big, archetypal ideas at play, and in lesser hands, it could have turned out much more dour. But Besson wisely injects the film with some wonderful humor and a light, breezy quality. In a way, I would almost favorably compare it to a cartoon. Albeit, a cartoon for grown-ups. It never takes itself too seriously, and has a massive fun-factor. It's just such a joy to watch this movie.<br/><br/>And then there's the style. And that's where the film really turns itself up to eleven! This is such a strange and unique film. There are so many wonderful details, eye-popping designs, wild costumes... you haven't seen anything quite like it! It's bold and vibrant and wondrous. Even sexy at times. This film is widely known for its insane visuals, and it's for a good reason. From the strange and otherworldly aliens to the hilariously revealing clothing to the vibrant pastel colors... Besson and his design team bring their A-game to the visuals. It's stunning.<br/><br/>The only place where the film sometimes falters is in the pacing. The movie moves quite fast, and as a result, you do get the odd bit of tonal whiplash. Silly scenes don't always flow well into the more serious plot-driven moments. But I'd be lying if I said that this was a major problem. It's just a minor flaw in an otherwise excellent package.<br/><br/>""The Fifth Element"" is one of the definitive popcorn movies. It's loud. It's vibrant. And it's a ton of fun! This is not only one of best popcorn flicks of the 90's. It's one of the best popcorn flicks ever made. Period. It's hard to be objective in a case such as this, but there's no other way around it. I gotta give ""The Fifth Element"" a 10. Is it a perfect film? No. But it is perfect fun? Yes. Most certainly, yes."
"shnames87","9","1","1","26 December 2019"," One of the Best
","This movie is not only a great action science fiction piece but it is shockingly funny as well. It combines great acting with a fresh original concept. I've loved this movie from the first time I saw it and still love it when ever I re-watch it. It holds up over time and is a generally beautifully shot film as well. Everyone should see this movie."
"ldcsp","7","1","1","18 December 2018"," The Fifth Element(1997)-Movie review
","The Fifth Element tells the story about five central elements, and the quest to find the last one to save the universe.
The Fifth Element is pretty much a crazy, funny, exciting and extravagant movie.
From a storytelling standpoint the script is not that original, however it is relatively well developed. The creation of the universe is amazing, the style of the creatures, the sets, the clothes. Its beautiful to look at.
The directing is also good, Besson has an eye for the big action pieces and to mix these inventive visuals and ideas into the movie. He's a really talented visual director, and you can see that he's having a great time.
The cast is also worth mention, Willis is good playing Corben Dallas, but Gary Oldman steals the show playing Zorg.
The movie has a big sense of fun, It's very entertainning.
In terms of negative aspects, it's problably a little too long and the script like I said before it's not that original.
Overall the Fifth Element is a visually stunning movie filled with a decent script, good directing, ideas, and it has above all a huge sense of fun.<br/><br/>7.5/10"
"limoosine","9","1","1","14 November 2018"," Absurd funny moving
","I loved this film. Truly a classic that is often forgotten but easily remembered when reminded. You will laugh and maybe cry in this over-the-top sci fi action adventure film."
"piggypiggy-19059","8","1","1","27 September 2018"," Pure fun
","This is just pure fun from start to finish. Bruce Willis when he was in his prime! It has romance, comedy, drama, action and adventure all rolled into an amazing sci fi flick. I could watch this any time every time."
"peterbouwmans","10","1","1","22 September 2018"," My all time favorite movie
","I really lost count how often I've watched this movie. It's the best movie ever made.<br/><br/>The colors, the actors, the perfect mix of humor, sci fi and action. It's the most enjoyable movie there is. You'll notice the special effects are from 1997, it doesn't matter. You'll love it.<br/><br/>If you haven't watched it yet: do it, now."
"lukeshulver","10","1","1","29 August 2018"," In my top 5 movies of all time!
","I have watched this movie at least 10 times and every time I do it still elicits laughter and awe. The most visually spectacular, amazingingly designed and detailed sets, the best written script, perfectly casted and stellar performances in the best sci-fi movie of our generation. And then there is the music score that manages to combine Opera with Techno and still be a believable future direction for the medium and almost becomes a character in its own right. Luc Beeson came as close to perfection as is possible with this movie. I have no doubt I will still be chuckling after another 10 viewings. I wish I could rate it higher as my 10/10 are must watch movies, but this deserves to be elevated above them all."
"suzybyrnes","10","1","1","7 August 2018"," Genius.
","Great SF movie. Wonderful style. Crazy characters. Excellent production design. I have loved it for we years. I have watched this movie at least once a year. Love it."
"scott-1657","10","1","1","12 July 2018"," Yes, big ba-da-boom
","So I waited 21 years to write this to let it all sink in. ;) This may just be my favorite go-to film of all time. Yeah, it's not CItizen Kane, or the Godfather, but, for me, it has all the elements, ha ha, I love. Adventure, humor, science fiction, fantasy...
Luc Besson has directed some of my favorite films, and his vision of this one is just amazing. As is the casting. Bruce Willis as Korben Dalls is at his prime here, a wise-ass cab driver who unwittingly has to save the world. How can anyone NOT be in love with Milla Jovovich as Leeloo? Gary Oldman is splendid as yet another psycho and ... is Chris Tucker playing... Prince? Well, RIP purple one, let's not even go there. But he's hysterically obnoxious.
No need for me to get any more in-depth. Just watch the film-if you don't absolutely love it ... well, you're not the sort of person I'd hang out with.
Multipass."
"arizonamansions","10","1","1","2 February 2018"," The Best Movie of ALL Time
","I think this is the best movie I have ever seen. I love how an action packed thriller becomes a love story. I am a sucker for love stories, and action, so this particular movie hit every spot in my soul. I love the Fifth Element, I am now on the search for a supreme being to fall in love with me! Ha Ha, wouldn't that be great!"
"axel-herrlin","Null","1","1","5 September 2017"," Fantastic sci-fi saga with humour
","This film has given me very much. For me it's nostalgic to watch since I've seen it 100+ times with my sister, learned about mystics, laughed and cried. For me, it's a film filled with what a lot of people go through with their relationships, beliefs, personal development ""in real life"" - all in an epic sci-fi. <br/><br/>The comedy is a big unload of the heavy meanings that you CAN find between the lines. <br/><br/>It's a classic saga about finding love, fight for love, fight against evil forces that desires death and destruction, being compassionate and caring for others.<br/><br/>""You can only be strong alone for a while, to succeed, you need help!"""
"KalKenobi83","8","1","1","17 July 2017"," One of The Oddest but Good Sci-Fi Film From Luc Beeson
","Watched The Fifth Element Featuring Featuring Bruce Willis(Die Hard) as Korben Dallas, Mila Jovovich(Dazed And Confused ) as Leeloo , Ian Holm(Alien) as Vito Cornelius, Chris Tucker(Jackie Brown) as Ruby Rhod, , Tommy Lister Jr.(Friday) as President Lindberg and Gary Oldman(Air Force One )as Jean-Baptiste Emanuel Zorg.The Film was interesting and a memorable working in sci-fi but it was a little weird but good it was like if Blade Runner met Flash Gordon the characters were memorable really Liked Korben Dallas and Vito Cornelius played excellently by Willis and Holm though the films Zorg was bit odd and wound tight .amazing score from Eric Serra(GoldenEye), Screenplay By Robert Mark Kamen(The Karate Kid),Production Design By Dan Weil(Total Eclipse), Cinematography By Thierry Arbogast(The Horseman On The Roof) and Direction By Luc Beeson(Leon The Professional) One of The Oddest but Good Sci-Fi Film From Luc Beeson 8/10"
"patomartinezfgo","7","1","1","8 July 2017"," Fun Sci-Fi movie
","This is a really fun sci-fi movie that will make you have a good time. The fifth element contains everything you need for a cheesy space adventure.<br/><br/>Obviously, most of the special effects look really sh*tty but of course, that is part of the charm. The whole movie has a level of cheesiness that just embraces you and makes you like it.<br/><br/>The story is great. All the lore surrounding the movie is pretty original and lets you expand your imagination a lot. And all of the set pieces just add to this very cool-looking world, although we don't fully understand it. There are bits and pieces that let you see what is going on, but nothing really explains what happened to the world. That is both a good thing and a bad thing.<br/><br/>The characters are the best thing in the movie. All of them are super fun to watch and really funny. Bruce Willis does an outstanding job as the main lead.<br/><br/>The only real problem I have with the film is the main character's motivation. I never really understood why he decided to be part of this conflict, and in my opinion, that is something that takes you out of the film. I just believe that this problem could be fixed pretty easily and I do not know why they didn't do it.<br/><br/>In conclusion, this is a fun, entertaining film with its fair share of cheesiness"
"tnk","Null","1","1","5 December 1998"," Finally we did it !!!
","When I went to see the 5th element, I thought it was another missed attempt to make a french sci-fi movie...I Was wrong !!!<br/><br/>For the first time in history, a french team managed to create a picture that could stand it against the biggest US blockbusters. SFX, Cinematic design, thrill fun, excellent music...all was in that movie.<br/><br/>The result among the audience was clear : everyone stood up at the end of the showed and applauded!<br/><br/>The next day in school, everyone spoke about it. Finally we did it! Our cinema was not anymore a boring one! It was really like a revelation for all of us !!! Thanks luc for that wonderful cinematographic experience!"
"Warlock-5","Null","1","1","29 November 1998"," Nice, but don't expect this to be a ""smart movie"".....
","When I saw this movie on video, I thought,""Wow!"" The visuals were really good and the whole movie was enjoyable. Why was this bagged out at the box office? It was a whole lot of fun. Just one complaint: I could not understand what the hell Chris Tucker was saying!! Did anyone else feel this way too?"
"geiri","8","1","1","13 November 1998"," This one won't fade away
","Two hundred and fifty years in the future, life as we know it is threatened by the arrival of Evil. Only the fifth element (played by Milla Jovovich) can stop the Evil from extinguishing life, as it tries to do every five thousand years. She is helped by ex-soldier, current-cab-driver, Corben Dallas (played by Bruce Willis), who is, in turn, helped by Prince/Arsenio clone, Ruby Rohd. Unfortunately, Evil is being assisted by Mr. Zorg (Gary Oldman), who seeks to profit from the chaos that Evil will bring, and his alien Mercenaries. The Fifth Element should be seen by all sci-fi film enthusiasts. It is absolutely loaded with an incredible jumble of eye candy. One amazing spectacle after another leaps onto the screen to thrill us. It is laced with very rich imagery, and demands repeated viewing to take in all the details thanks to great direction by French director Luc Besson. The story is a disaster and I had to watch this film 2 times to appreciate it, and now I love it. Bruce Willis, Gary Oldman and Milla Jovovich are superb in their acting and there are only few problems with the film thatare not importent."
"alfa-5","Null","1","1","11 November 1998"," Absolutely stunning! A true work of art.
","The 5th Element left me stunned with surprise. It's witty, funny script put together with action packed screenplay made for an excellent film. Luc Besson directed the world's best sci-fi farse. And a brilliant one at that. The movie's seriousness almost makes fun of all the sci-fi's of the past. Add to this the excellent acting of Bruce Willis, Milla Jovovich and, of course Gary Oldman, my favourite, and the result is the best movie ever made. It makes you laugh, jump up and down on your seat, eat popcorn like never before and feel like you're actually a part of the film.<br/><br/>There is definitely no future without it."
"cliffhan","10","1","1","6 November 1998"," Quirky and cool, not your typical Hollywood flick.
","This is one of my favorite flicks. It's not typical Hollywood cookie-cutter fare. Cool music, interesting and strange aliens, and original and rememberable characters. They didn't spend a trillion dollars on SPFX, but that's okay. This was not a movie written by committee. It was obviously one person's vision where the studio did not butt in and screw it up. It helps that Bruce Willis is one of my favorite actors, but the supporting cast was excellent as well. Like Blade Runner, it wasn't a box office cash cow, but again, that's okay. True Science Fiction fans are used to being lonely."
"SdB","9","1","1","29 August 1998"," Finally! Some creativity in Science-Fiction
","Finally! No more simple Men-in-black and Independence Day science-fiction. This movie has everything your fantasy has ever imagined outerspace. The aliens are very convincing and alive. The colors, machinery and sights are very creative and the clothing by Jean Paul Gaultier is extraordinary. This movie is a pleasure for the eye and very un-american. Bruce Willis is very pleasantly cliche without overdoing. This image of the future is very cynical and taken from great science-fiction books. Luc Besson has done his homework. My compliments. A fantastic movie!"
"JCHoefer","10","1","1","5 November 1998"," Definitely One of the Decades 10 Best
","Polarization.  That's what this movie does.  People either hate it or love it.  Personally, I love it!  It has exactly what I look for in a film: Action, Comedy, Romance, Suspense and FX.  In fact, it's the reason I bought my DVD player! Sure, the plot had some holes.  I don't know of any movie that doesn't. But if you create a movie that is visually stunning, witty, and can keep you on the edge of your seat for 2 hours, then plot holes seem to disappear. I was particularly impressed with the costumes.  Very futuristic, and appropriate considering the overall look of the film.  The music is top-notch.  If you haven't purchased the sound-track, please do.  It's a great combination of orchestration, techno-style rock, urban, and classical. Most everyone I know who has seen the movie loves it.  There are always exceptions, but overall, you do not have to be a sci-fi fanatic to appreciate The Fifth Element."
"Karma","Null","1","1","27 October 1998"," Some people just don't understand Sci-Fi
","Imagine if people came out to say, ""Oh please, A giant walking Teddy Bear. How outrageous!"" about our favorite Wookie. Sci-Fi IS outrageous. The 5th Element takes a look into an unwritten future and does a very good job of story telling. When Bruce Willis wakes up, reads the words ""KEEP CLEAR"", and sighs ""I try"" he speaks the same sentiments most of the working class share. This is a great Fantasy with colors and action that jump off the screen. I feel Bruce Willis does a great job playing the reluctant hero that doesn't really care about the world's dilemma, only his own search for the perfect love. The 5th Element is the perfect movie for sci-fi buffs who can set reality aside and see the story at hand instead of comparing everthing to Star Wars. The rest of the story is fast moving with great performances by Gary Oldman, Milla Jovovich, and Chris Tucker. As far as I'm concerned the movie wasn't long enough."
"triffids","10","1","1","20 October 1998"," So glad to find the 'chosen'
","Alas, I have searched far and wide among 'the knowing' aka critics to find supporters of this film....was I wrong to immediately purchase the video after only one viewing?...was my favourite, STAR WARS trilogy, to fall under the stones of the four elements with no-one to support me?...are the nuances of this movie as amazing as I see them (or was it that very special dry white wine?)....NOW I KNOW....I have found the chosen at this site, those with vision, childhood glee, and a true recognition that this is just the most amazing, well-dialogued, beautifully crafted and fun.....FUN...movie in a very long time. I recommend The Fifth Element to all of my friends as a test...if they like it, on any level, they remain friends....if not.....I am very disappointed.........."
