"username","rating","helpful","total","date","title","review"
"drawlife","6","4","6","4 December 2014"," More action, more scares, and more dinosaurs.
","This was the first Jurassic Park film I saw in theaters, I was barely an infant when the first one was released, but I was old enough, and accompanied by my teenage aunt to see this film in theaters in the summer of 1997. As a child watching it, I remember being scared a terrified, clenching my butt-hole the whole time, and holding on to my aunts arm tightly. <br/><br/>Because of that experience The Lost World: Jurassic Park holds a special place in my heart, as cheesy as that sounds. I know many might see this film as an inferior sequel, but for me personally, I get a kick out of it and still do, despite it being slightly mediocre. <br/><br/>This time around there are more dinosaurs, more action, and even more scares. I thought that in this film, Spielberg does a more effective job at creating tension and suspense. Once again Spielberg effectively uses the dinosaurs in every scene they're in, not to mention they look even better. The scenes involving the Compsognathus left me scarred in my youth and it still sends shivers down my spine every time I re-watch this film. The Stegosaurus scene involving Julianne Moore's character Dr. Sarah Harding, doesn't quite capture the magic of the Brachiosaurus scene, but still tender. The Velociraptors are again effectively used for scares and are even more vicious. There are three T-Rexes this time in the film, two being parents of an infant and they are the stars in this film. There's an awesome sequence involving a T-Rex rampaging across San Diego. <br/><br/>The film's weak point, as it was in the first film are the characters. This time around Dr. Ian Malcolm is a different man. Jeff Goldblum, although his performance is dry, but it works for his character. He isn't the same man he used to be since the first film so it was neat to see Malcolm become a different person. Aside from Malcolm getting most of the spotlight, the rest of the characters are flat, aside from showing off hints of their personalities. I enjoyed Vince Vaughn's Nick Van Owen, he was full of wisecracks. I also very much enjoyed Pete Postlethwaite as Roland Temdo the hunter and tracker, who was in a way similar to Bob Peck's role in the first film. <br/><br/>Aside from them I didn't really care much for the other characters. I was annoyed with Julianne Moore's character, as with the main villain of the film Peter Ludlow, portrayed by Arliss Howard, who now took over Ingen from his uncle John Hammond. He now wants to capture some of the dinosaurs and bring them to a park built in San Diego, something John Hammond does not want. Vanessa Lee Chester also fills in the void for Lex and Tim. It felt like a rehash of the first film, despite her pretty cool moment with a Velociraptor in the film. It feels as though, while watching this film, the characters are a lot smarter than they appear to be. I mean why would they do what they're doing when they clearly know that everything they're doing is a bad idea. You can't help but wonder these thoughts while in viewing. <br/><br/>Despite all this, every moment with the dinosaurs are golden. Even though we don't really care about some of the characters in the film, the stakes are higher and it's fun seeing them in peril, and it makes for an entertaining film. The action sequences are twice as exhilarating, one involving a trailer over the cliff will surely have you grip on to something. Not to mention John Williams's score this time around is more energetic and just as good as the first one. To sum it up this sequel is everything that you'd expect, more action, more dinosaurs, more thrills, and a higher body count. It's a fun ride throughout and provides more than the first film in terms of scale and stakes, but it's not completely refreshing as it's predecessor. <br/><br/>6/10"
"luvkittys7","6","4","6","19 June 2012"," Entertaining enough. But Lacks Something From The First One
","It's a good movie, and nice way to distract yourself for a few hours. But it is not nearly as well put together as the first movie in this series. The original Jurassic Park had scenes that were so classic, so breathtakingly suspenseful, that it would be almost impossible to top them. Also, the first movie did a wonderful job of mixing the bright and sunny scenes while contrasting it with the dark and rainy ones. I felt The Lost World was a lot darker and didn't take enough time to show off the beauty of the Island. One exceptional moment for me in this film was the window glass cracking scene when they were dangling over the cliff. That was unique and breathtaking suspense. It was scarier than the dinosaurs, actually, which is kind of sad. Still, all in all, not a bad movie. It just lacks something from the first one."
"CuriosityKilledShawn","7","4","6","2 March 2012"," Found it!
","I enjoyed The Lost World more than Jurassic Park, it's a darker, bloodier film with a higher body count, and, visually, it's a lot more complex. It's a shame that Dean Cundey didn't return (Spielberg never worked with him again, and hired Janusz KamiÅ„ski this time around) though. The story is almost the same thing done again, but it doesn't have those awful kids in it...much.<br/><br/>Set four years after the Isla Nublar incident, Ian Malcolm is forced by John Hammond to confront the dinos once more on Isla Sorna (or Site B), the place where InGen bred the animals before moving them to Jurassic Park. The InGen board have taken control of the company and prepare to move the dinos to the mainland. But not before 80 minutes of gobbling up the lesser characters. Yes, it's derivative, but it gives us less of what made JP bad, and more of what made it good.<br/><br/>There seems to be a lot of trims and cuts to The Lost World. It doesn't make for any distinct continuity errors but there are some noticeable jumps in the pacing. There have been many complaints that the film is overlong, however I think that it's more exciting than the original. There are some nail-biting scenes (the trailers hanging over the cliff) and the dinos are scarier this time. I love the ending with the T-Rex storming around San Diego.<br/><br/>Again, there have loads of complaints that this ending is over-the-top, which I think is a ridiculous grievance. Action movies build to a big finish and, since JP1 and JP3 had no climax at all, the Lost World has the best ending of the trilogy. There's no theme of mankind playing God this time, just straight-up action, which also seems like a bit of a waste considering Ian Malcolm's cerebral analysis of the situation on Site A. There are some attempts at character arcs, but they fall flat. I really don't care about Pete Postlethwaite suddenly becoming disillusioned after capturing the T-Rex, and they missed the opportunity for Malcolm to tell them 'I told you so' when chaos erupts. And am I the only one who got confused at the fact that the characters of Ludlow and Ajay look virtually identical? Bad casting choices there, man.<br/><br/>Despite all of this, I still think The Lost World is better than the first, even if all the cons negate the pros, it doesn't have those horrible children (apart from 3 minutes at the start)."
"Rockin_Joe_87","10","4","6","16 March 2010"," 65 Million Thumbs Up!
","To follow up a masterpiece as the first Jurassic Park movie, my personal favourite movie of all time, was always going to be such an uphill task. Thankfully Steven Spielberg was behind the camera once again, and has, once again, provided us with another prehistoric blockbuster masterpiece. Jeff Goldblum and Richard Attenborough also return, with the latter returning only briefly, and Julianne Moore, Pete Postlethwaite and Arliss Howard join the cast and all do a tremendous job. Excitingly for us, the dinosaurs also return. Now there are two Tyrannosaurus Rex's, plus a baby, and the Tyrannosaurus in San Diego is almost a fantasy for dinosaur fanatics. This movie has adventure and suspense, all played to the highest level."
"kurciasbezdalas","10","4","6","7 December 2008"," Much better than it's prequel
","I don't even know where to start, everything that made the first part good is twice as better and more in this part. There's much better special effects, there's more action, there's much more dinosaurs (though I missed the one who's spitting poison), there's more catastrophes and there's much higher body account (the best thing about it is that most of the victims deserved to die). Jeff Goldblum get more of the show this time, but his character was kinda dull this time (probobly to make this film more realistic, because he has suffered a lot). I liked the first part, but compared to this one it seems so poor to me."
"TheMan3051","9","4","6","11 November 2002"," Just When you Thought It was Save to Go Back to Disney World
","Directed by Steven Spielberg this sequel is as good as the original. It keeps it as fresh, funny, and exciting as the original. And the only advantage this sequel has over the original is the ending. Honestly the ending to this movie is A LOT better and exciting then the original.<br/><br/>3 1/2(***1/2)out of 4(****)stars"
"Chamby_X","9","4","6","20 August 2001"," A good follow up
","A couple months ago I would have trashed this movie. When it came out I had high hopes for it, as before seeing it I had read Crichton's excellent novel and could only imagine how great a big screen adaptation would be. Obviously, The Lost World is nothing like the novel it's 'based' on, and this angered me for a while. After seeing the recently released Jurassic Park 3, however, I finally am able to separate the JP movies and books into two very different spins on a similar story. Having accepted that, I can now look at the Lost World once more as it's own movie and look at how it fits into the series. I think it fits in very well.<br/><br/>I won't bother detailing the story, everyone already knows it. Jeff Goldblum does a great job stepping back into his Ian Malcom character, the supporting characters especially Vince Vaughan are great too. The dinosaurs, which is what everyone wants to see, are similarily well done. There's nothing really new from the first movie save for some stegos and pachycepholasaurs (sp?) but that doesn't matter as they all look as good if not better then they did in the first one.<br/><br/>Now, as for the San Diego ending, at first I hated it and thought it screwed up the movie, now I don't. The scene is quite interesting in it's Godzilla kind of way, and the idea of the whole world knowing about the dino islands is good as it allows for more sequel ideas, which I certainly want to see. 4 out of 5 from me, and JP3 does it even better."
"Leonidos","2","24","58","10 December 2000"," Wasn't there some kind of book at one point?
","**SPOILERS**One of my biggest complaints with this movie was the tagline ""Something has survived.""  So?  Why wouldn't something have survived?  As I recall at the end of Jurassic Park everyone just evacuates the island and leaves the dinosaurs to themselves so of course something has survived.  Now if you read the book where they bomb the island back to the stone age (no pun intended) it would make sense that everything should have been dead.  Then they go on to tell us that it was based on Michael Crichton's book.  Could someone please tell me which parts?  (spoilers) First of all the opening scene where the girl gets attacked by the compys is actually the beginning to the FIRST book.  What was up with that?  Then when we get into the plot the ONLY character that even remotely resembled his character from the book was Ian Malcolm.  The rest of the characters were either one character's name transplanted onto another's personality or completely made up for the movie such as the ENTIRE expedition that was attempting to capture live dinosaurs.  Then at the end that whole T-Rex rampage through town, what moron thought that would be a good idea?  Another element that never happend in the book.  O.K. I understand that movies are basically never exactly like the book, but shouldn't there have been at least ONE scene from the book included in the movie?  The only one I can remember is the T-Rexs kicking the trailers off the cliff and the kicking of the trailers was the only thing about that scene that was correct nothing else.  One last question: What was the high hide hanging from?<br/><br/>
""Gentleman, you can't fight in here! This is the war room!"""
"JamieClay","1","31","78","13 November 2000"," Just because they could make a squeal, did anyone stop to ask if they should? (Ok, that was too easy)
","The only thing good about this film being made was that it gave the team of ILM and Stan Winston a chance to improve their skills with dinosaur simulation technology, other than that it was a remarkable waste of talent.<br/><br/>
I read Jurassic Park AFTER seeing the movie and loved the book. Subsequently, I read Lost World BEFORE seeing the movie and knew there could be trouble.  The book was extremely contrived so I had hoped the movie under the right direction would prevail.  Well it didn't, in fact it went in just the opposite direction.<br/><br/>Not only was the film 100 times more contrived, it suffered from poor casting and direction as well.  At times this film is laugh out loud bad, much so it doesn't really warrant any further discussion unless after seeing it, you disagree with me.<br/><br/>With that said, watch this film with your finger poised on the fast forward button so you can quickly get to the great effect scenes. My only hope is that the makers of JP III learned something from the story failure of JP II. I'm not holding my breath.<br/><br/>Oh, before I let you go...if anyone who has seen this film can explain to me how a T-Rex (the only dinosaur on the ship) got into the control bridge of the cargo ship and ate the crew (left a hand on the wheel), left the room pretty much intact, then managed to get trapped in the cargo hold before the ship crashed into the dock...I'd like to know.  (seems to me they meant to have raptors but just ran out of DNA-ero.)"
"MovieFan983","9","7","13","9 December 1998"," Great sequel, one thing better is....
","More dinos, this movie had much more dinos than the first one did, it had more action, and more violence. It wasn't better cause it was equal. I give it a 9 out of 10 or **** out of 4 stars. Jurassic Park gets the same rating."
"dellamorte-44869","4","9","18","9 September 2018"," Disappointment
","Parts are ok. But the dialogue is atrocious and the lighting goes for moodiness but can seem TOO dark. The third act is where this film really lost me but that's up to the viewer. Prepare for disappointment"
"livwilkins","1","9","18","7 September 2018"," Boooooo
","A dog dies so I hate this movie and now my dog is only allowed to sleep inside the house"
"Lucas_aka_Ze","8","57","160","29 March 2018"," We need mire sequels
","I don't get the hate <br/><br/>Its a great movie and a great story.<br/><br/>Can't we just appreciate Spielbergs work ?!"
"g-bodyl","9","6","11","24 October 2008"," Good Sequel!
","The Lost World is a nice sequel to watch. In retrospect, it should be based on the book but it's not. Who cares? I sure don't. The story begins with a girl getting attacked by small dinosaurs. Because of the incident, John Hammond sends Ian Malcolm back to the islands to document the island and find his girlfriend. Even if the storyline wasn't developed well, everything makes up for it. The acting is great(Goldblum, Vaughn, Moore). There are new dinosaurs and more T-Rexs. The special effects are great, even by today's standards. John Williams returns with another momentous score. The music is more darker in the film. I think that this movie is even scarier than the first Jurassic Park. I have no idea why people are bashing this movie. I rate this movie 9/10."
"Elswet","9","6","11","30 September 2003"," Almost as good as the original!
","While this movie was not quite the same brilliant combination of effects, cast, characters and magic Spielberg delivered in the first production, I still found this sequel just as enjoyable as the first.<br/><br/>The cast members are just as professional, and while they did not have the same original cast (a mistake most sequels make), Dr. Ian Malcolm (Jeff Goldblum) does return. That was fine by me. He as my favorite character from the first movie, anyway. Joined by<br/><br/>Julianne Moore as Dr. Sarah Harding and Vanessa Lee Chester who brilliantly portrayed Malcolm's daughter, Kelly, they attempt to recreate the magic of ""Jurassic Park.""<br/><br/>While they did not quite succeed in accomplishing the totality of the first, they did present the world with an excellent finished product which I found extremely fun to watch and highly entertaining.<br/><br/>Plot: John Hammond is at it again, but this time, he is on the side of the environmentalist. InGen has been taken out of his control and he must stop his nephew from exploiting the dinosaurs kept as breeding stock for a possible second attempt at Jurassic Park's opening.<br/><br/>Hammond already has a team on the island to observe and ensure that his nephew does not interfere with the island's inhabitants; ie: the dinosaurs created by Hammond and the InGen team of genetic scientists. During the course of his conversation with Dr. Malcolm, whose reputation is now ruined because of the controversy behind his tales of the disastrous trek to Isla Nebular, Hammond discloses that the new team is not on Isla Nebular, but on a secret island developed as ""Site B,"" called Isla Sorna which is 87 miles south of the original site.<br/><br/>Naturally, Malcolm refuses to go (who wouldn't!) and is on his way out when Hammond reveals that Malcolm's girlfriend, Dr. Sarah Harding, is already on the island as part of the research team.<br/><br/>""This is no longer a research mission. It's a rescue mission, and it's leaving right NOW!"" Dr. Ian Malcolm.<br/><br/>The dinosaurs were done just as wonderfully in this fine sequel, as in the original; the dialogue was just as witty and clever; the characters were just as believable and well developed; and you honestly did not have to be witness to the first movie to fully enjoy this one. The only things that were lacking, for me, were (1) the wonderful cinematography; those excellent landscapes which were prevalent in the first. This one felt more deliberate; less spontaneous, than its predecessor. <br/><br/>That was due to (2) one badly-developed, poorly portrayed character, and unfortunately, he was one of the leading characters in the script. Arliss Howard as Peter Ludlow, John Hammond's egocentric nephew. I am unsure as to whether his acting quality was trite and stiff, or his character was written that way, but whatever it was, it did disrupt the quality of the movie, in my opinion. These two things combined, lowers my opinion of the movie, but only in comparison to the original, and only a little bit.<br/><br/>This is still a very good sequel which stands alone without depending on the first plot to carry it.<br/><br/>It earns an 8.6/10 from...<br/><br/>the Fiend :."
"Peter T. Movie","9","6","11","20 November 1999"," I liked it.
","The Lost World: Jurassic Park is a very enjoyable film and almost lives up to the first one. When I saw it in 1997 for the first time, I was shaking like crazy. The scenes that scared me the most where:<br/><br/>1. the first scene with the T-rexes when Sara opens the door of the trailer and the T-rex is staring right at her.<br/><br/>2. when to T-rex sticks it's head in the tent.(I was terrified!)<br/><br/>3. when Sara is on the cracking class.<br/><br/>4. when the Raptor jumps on sara's back.(that was completely unexpected).<br/><br/>
I love both JP movies and I own them also. The main reasons why a lot of people disliked this movie is either they were expecting too much, or they just don't look for the right things in a movie. When I look at a JP movie, I look for suspense, action, surprises, good acting, and realism. The Lost World provided all of that. Therefore I liked it. When I saw The Lost World in the theater, I walked away from that movie convinced that I had seen a real Dinosaur. THAT, my friends, is what makes JP movies so wonderful. Jurassic Park and it's sequal are the only movies in the world that can do that (when it comes to dinosaurs). Godzilla('98), lacks all of that except action which is not enough to make a good movie. Godzilla and his babies had no personalities, because of this, it was very hard to believe Godzilla was real. Jurassic Park movies give all of there Dinosaurs personalities. When you watch a JP movie, you know the difference between the way a Raptor acts and the way a T-rex acts. If it wasn't for that, the Dinosaurs would be faker than ever, regardless of the really good CGI. The Dinosaurs do more than just run around eating people, each Dinosaur does it their own way. I encourage everyone to give this over bashed sequel a different look. You might be surprised!<br/><br/>My rating: 9 out of 10. One point lost for story."
"Kyle007","10","8","16","8 March 2005"," What an adventure!!!!!!!
","Wow, this is the first Jurassic Park movie i saw and i have to say it really blew my head, it was just great, i had an incredible moment in the cinema that day, one of the best i have had in a cinema.<br/><br/>Somebody said in other comment that there was no chemistry among the characters, bah, that's a big lie, they had a relation very funny and did really fit in the story, and the product of their relationship was really amusing. The actors did a great job and gave the characters a really definite personality, for example, Ian Malcom (Jeff Goldblum) was the whole movie complaining of everything he could and was always ill-humored, Sarah Harding (Julianne Moore) was an adventurer-paleontologist that really wanted to change her life of bones digging out, Nick Van Owen (Vince Vaughn) was photographer that only worked for acknowledgment.......and money, of course......and so, if you mix them up you get an eccentric and funny mixture. Richard Attenboroughplayed a short but nice part in this movie.<br/><br/>The script was really good despite of all those here that think not, it had a great plot and had a lot of funny lines, specially for Jeff Goldblum, and i couldn't help laughing, the jokes are very very smart, not cheap ones.<br/><br/>The special effects are a subject apart here in this movie, i think this movie has the greatest of all time and haven't been excelled yet. The dinosaurs seemed alive and more (the first time i saw it i thought they were real, i was a kid then, don't get me wrong, i knew dinosaurs were extinct, but i just couldn't think this was a product of computers) The scene when the In-gen team arrives to the island and they chase the dinosaurs is worthy of admiration and it's not the only one.<br/><br/>The music is the classic from the first, and so, it couldn't be better. It could adjust to scare tunes, to fun and adventure ones.<br/><br/>Spielberg did a great job with this movie better than with the first one, this is the best of all until now, let's wait for the forth movie and expect it will be as good as this, let's hope so.<br/><br/>So resuming, this is one of the greatest movies that i've seen, (and i've seen lots) and should have a rating much superior than it has now, come on, you have to be fair......."
