"username","rating","helpful","total","date","title","review"
"pyrocitor","8","7","16","18 October 2008"," Painting with broad strokes
","Many have referred to the recent career of American auteur Woody Allen as his 'European vacation', having departed his beloved New York to begin experimenting with different narratives and cultural observations overseas. It would seem Vicky Cristina Barcelona proves the end of Allen's 'vacation' (his next film marks a return to New York) and as such, Allen seems determined to make the most of his last departure from tradition, toying with narrative, character and thematic development. The resulting film as such feels slightly piecemeal, but hardly in a negative sense, as Vicky Cristina Barcelona merely brims with the impulsive exploring one would expect at the end of a vacation, and the impulsive sense of artistic whimsy is one difficult to resist. <br/><br/>While once again abstaining from his traditional New York locations (this time transposing his pallet from England to Spain) and trademark neurotic humour, Allen demonstrates a welcome return to his acute knack for dissecting and observing human behaviour. Exploring a myriad of sexual habits and practices as well as his usual meditations on the nature and quality of love, the potentially redundant and overdone source material is given a fresh and fascinating spin in the hands of the veteran storyteller. But given his past credentials, it is interesting to see Allen experimenting with a different cinematic voice, albeit one which is still easily recognizable as his. Despite his complex and profound subject matter, Allen's sparse and rather matter of fact script feels almost overly simplistic, the bulk of the character development and contextual grounding of the plot performed in concise, clipped sound bites - rather than the viewer inferring Johansson's character to be neurotic and afraid of commitment, we are simply informed that she is as such, a tendency which comes across as rather jarring at first. <br/><br/>However, Allen's shrewdly cunning scripting makes such a narrative voice clear to be a deliberate choice rather than simply poor writing, as if tiding the viewer by with blunt surface description while leaving the inherent subtleties left to be discovered by the viewer. The comparison can be made to Bardem's painter character, as it seems Allen has simply chosen to paint with broad strokes, his deceptively simplistic overtones masking a far more complicated and fascinating underbelly left mainly to the viewer to discover through what is not said, rather than what is.<br/><br/>Nonetheless, not all of the film's potential problems can be explained away as deliberate artistic decisions quite as easily, particularly an ill-advised omnipresent narration, which starts off giving the impression of being sharp and satirical, but becomes quickly overused, after which it abruptly disappears for almost the rest of the film. This tendency to tell not show makes Allen's film feel remarkably un-cinematic at times, with the narration seeming a lazy and complacent way of quickening the story rather than letting it unfold, undermining an otherwise refreshingly unique and fascinating narrative. Similarly, the overuse of certain musical motifs becomes frustratingly repetitive, although the beautiful Spanish architecture and locations are captured with an excellent touristic flourish, sweeping the viewer up in the heady luxury of a Spanish holiday as the protagonists themselves. <br/><br/>Despite excellent past work as Allen's latest female muse, Scarlett Johansson appears somewhat wasted here, her usual spunky exuberance and sultry charisma appearing oddly stunted. Paradoxically, her character, who in theory should have been the most interesting (the struggling artist attempting to find her niche in life and love, while welcoming experimentation along the way) disappointingly proves one of the more poorly written, and although Johansson does her best, infusing her character with an appropriate degree of teasingly seductive charm, it is a shame her character was not explored more fully. The true breakout star of the picture is Rebecca Hall, last seen as Christian Bale's wife in magician thriller The Prestige. Hall shines as a more typical Allen leading lady, mastering the neurotic self-guessing, pragmatism and guilt-inducing impulsive spells of her character with a particular down to earth yet bubbly style all her own - an entirely credible and hugely enjoyable performance. <br/><br/>Javier Bardem is perfectly cast as the suavely overconfident artist just as determined to drink in the pleasures of life as he is cynically convinced of its worthlessness, his comic deadpan and extravagant screen presence making him a perfect foil for both leading ladies. However, it is the entrance of Penelope Cruz halfway through the film when the plot really picks up speed, her suicidal, fiercely proud yet chaotically unpredictable artist and ex-wife of Bardem's character proving a sublime catalyst for the other major characters to play off of. It is impossible to imagine a more fitting performance than Cruz's for the role, her ferocious, borderline psychotic energy proving alternately hilarious and terrifying. Patricia Clarkson also gives a typically strong performance as the family friend of Vicky's putting the two women up for the summer, and Kevin Dunn is a suitably distant presence as her absent husband. <br/><br/>Few movies provide such an odd mishmash of quietly whimsical storytelling touches, but there is no question that Allen's Vicky Cristina Barcelona adds up to an altogether pleasant experience. With appealingly complex undertones discernible beyond the deceptively simple exterior and peppered with an array of terrific performances, while the film may be somewhat of a departure of form for Allen, it is a welcome return to his intelligent introspection and quality of old, and one without question worth a watch. <br/><br/>-7.5/10"
"mistarkus","9","7","16","25 August 2008"," Brief wonderful trip to Barcelona
","Take a sojourn for a couple of hours to the romantic streets and country side of Barcelona. The beige pastel landscapes, the enchanted dreamlike streets, the surreal Gaudi monuments and amorous cafes all evoke a romantic escapade in Barcelona. Scenery and setting are an integral part of Woody's great films. As we typically see in Woody's films, like the movie Manhattan, where the sleepy streets and sites of grey, nostalgic New York take on a character of its own as the human characters discourse in front of it, we again feel his new European locale as though we are there ourselves. We are shown a lot of the defining sites of the culturally rich city.<br/><br/>Woody is a genius at capturing the mindset of people, of the times, especially with regards to courting etiquette and he continues to brilliantly totally possess an understanding of and be able to pierce into contemporary times. He understands and documents real human emotion and these real people draw us into his movies and this one. He does it with a literary flair and although people don't actually talk like how he portrays them, it is amusing to listen to the literary rich dialogue. <br/><br/>The movie resonates with Woody's philosophy and commentary with a tad of humor on his current theme of love and passion. By utilizing two contrasting personalities with contrasting view points on love and passion, woody makes an intriguing commentary on the subject. One with an indulgently bohemian outlook, boldly and constantly searches for the possibly unattainable or nearly impossible ideal which ultimately keeps her in hopeless situations and the other with a more conservative stance has more ""grounded and settled"" ideals and dubiously believes in the happily ever after bit. Both polar opposites are presented an amusingly similar circumstance and it is fun to see how the situation unfolds. Then Penelope Cruz's character emerges as a spicy twist to the story.<br/><br/>There is less humor in his later great movies than in the early ones and there is no longer any slapstick. But he still enjoys poking fun at his characters and since they are so believable he is poking fun at real people in a satirical way.<br/><br/>One of the most interestingly beautiful movies this year so far. And definitely one of Woody's best."
"george.schmidt","9","7","16","18 August 2008"," Sexy/Crazy/Cool - Allen returns to form; Cruz a lock for Best Supporting Actress
","VICKY CRISTINA BARCELONA (2008) ***1/2 Javier Bardem, Scarlett Johansson, Rebecca Hall, Penelope Cruz, Patricia Clarkson, Kevin Dunn, Chris Messina. Woody Allen returns to form in this sexy/crazy/cool rom-com set in the exotique Barcelona where 2 Americans abroad (Johansson and Hall) are seduced by a rakish Spanish artiste (Bardem having a blast) only to become involved with a tangled relationship with his unbalanced ex-wife (Cruz, a lock for Best Supporting Actress, in one of her finest performances to date) in their bohemian lifestyle. Funny, smart, shrewd and neurotic  all Allen trademarks  with the European flavors at full force. The film only is demerited by the unwelcome narration by Christopher Evan Welch."
"rogerdarlington","Null","3","5","16 October 2010"," Something different from Woody
","I'm not a constant Woody Allen fan - so I loved ""Hannah And Her Sisters"" and then was disappointed by ""Scoop"" - but this film, which he both wrote and directed, is something different. Of course, it does no harm that it is full of attractive people - Rebecca Hall as the restrained Vicky and Scarlett Johansson as the impulsive Cristina, two young American friends spending the summer in Catalonia, plus Javier Bardem as Juan Antonio and Penélope Cruz as Maria Elena, Spanish artists who once had the near-prefect marriage - and of gorgeous locations - Gaudí's Barcelona, of course, but also Oviedo and Avilés.<br/><br/>What makes the movie though is the relationships and inter-relationships, mainly between these four colourful and contrasting characters but also between Vicky and her fiancé and an older American couple who seem to foretell where one of the young women is going. The acting is very naturalistic and the script has its fair share of humour in a narrative that presents a shifting kaleidoscope of emotions. When the shaking stops, how different will things be? You might be surprised ..."
"ozar_33-1","8","8","20","15 August 2008"," Entertaining and funny, Woody's still got it!
","People have been criticizing Allen recently for taking himself too seriously and not meshing his more dramatic subject matter with the comedic elements of his screenplays, thus creating half-assed contrivances like last year's Cassandra's Dream, but Vicky Cristina Barcelona is a sure improvement. No, it's not a completely original entrance into the Woody canon; a lot of his prior themes about sex, love, and the consequences each can respectively produce pop up here but somehow he still manages to make it all seem fresh.<br/><br/>Vicky Cristina Barcelona goes down easy. It's a deceptively simple meditation on the connection between love, art, and the ability to express oneself romantically and emotionally through the medium. Watching the film feels like spending a breezy afternoon in the beautiful titular city while the security and assurance one holds so closely crumbles around them. The two titular characters arrive in Barcelona with smiles on their faces, ready to relax and enjoy their youthful freedom, having no idea what's about to hit them.<br/><br/>Allen slyly and ironically plays on the whole notion of foreign escapism. Most people hold this notion that they can get away from their current lives and lose themselves in another culture and with this film, Allen explores the sometimes negative aspects of enveloping oneself into something one just doesn't understand. Indeed, it's what both Vicky and Cristina do, as their entire self-confident personas are stripped down to bare nothingness during their stay in Spain, by the simple and simultaneously complex chemistry of two past-lovers played energetically by Javier Bardem and Penelope Cruz.<br/><br/>But none of what is mentioned above is ever treated with the slightest heavy-hand. While it may sound grim, Allen perfectly induces a little comedy around each and every corner to remind us just how ridiculously irrational we can get over the trivialities of love. It's always fun, never mindless, and consistently well-written throughout, as one would come to expect of Allen.<br/><br/>There is one glaring flaw however, and that is the often pointless narration. Every now and then a detached voice-over will tune in to describe what we can already tell from the images on screen. At other times, he'll describe the character's feelings or give background on certain situations. It's a lazy tactic that replaces what the actors should already be doing themselves and what the script should've indicated via character development. However, it gives the film this oddly lived-in feel, like an old scrapbook of forgotten memories to a trip to Spain.<br/><br/>The performances are all impressive. As expected, Bardem and Cruz are sizzling on screen, their chemistry is completely undeniable, even when it seems like they're about to get at each other's throats. Newcomer Rebecca Hall gives the most emotional performance, as her character is swayed passionately numerous times throughout the film, portraying a woman who is unsure of her grip on life. And Johansson turns in her best performance in a Woody Allen picture, playing a woman whose liberties are challenged by the even more unconventional and unplanned lifestyles of the couple she falls for.<br/><br/>In the end, the film is an assurance that Allen still has ""it"" and is feeling ever more confident behind the lens. Vicky Cristina Barcelona is a highly entertaining, funny, and often heartfelt play on that little thing called love."
"cultfilmfan","10","7","17","21 August 2008"," Vicky Cristina Barcelona
","Vicky Cristina Barcelona is about two American friends who are both in their twenties, who decide to go to Spain for a few months during the summer. The first of two girls is Vicky who is engaged to be married to her fiancé back home in America. Vicky is studying to complete her masters degree and overall is more of a conservative person. Cristina on the other hand has been in some amateurish type films and she really longs for romance whether it may be a one night stand, or a real lasting one. Cristina is a lot more adventurous which can not always be a good thing and even though at times Vicky and Cristina are the total opposites of each other they still work together well as good friends. While on their trip in Spain they meet an older Spanish artist who invites the both of them to come stay with him at his house and enjoy the many sights around them. Ultimately the film is about relationships. Some that work, others that do not and for people who get left out and are not particularly too sure of what they want. All this is told through narration and of course great dialogue and acting from the cast. Some of the television advertisements for Vicky Cristina Barcelona make the film look like some sexy, or erotic comedy, but I can most assuredly tell you that this film is neither one of those two things. Instead we are treated to a really interesting character study about relationships and the trials and sometimes the not so always pleasant things that happen in them. I found a lot of the film to be an accurate and honest look of this subject by providing us with everyday characters who would probably handle the relationships in this movie like most people of their age, or even older would as well. The writing and dialogue from writer/director Woody Allen is at it's best and he really deserves a Best Original Screenplay nomination for the film not only because of the well spoken, thought provoking and sometimes funny dialogue, bur for also writing and crafting such a story with some unique and overall really human and realistic characters that are examined in this tale of relationships which is a subject that Woody Allen does often and well too. The acting for the most part was really good with a standout performance by Rebecca Hall as Vicky. The other performances are quite good too, but I found Rebecca's performance as Vicky had the most emotion and depth to it and she delivered it perfectly. Spanish actors Javier Bardem and Penelope Cruz yelling back and forth in Spanish at each other is also very interesting to watch and I enjoyed Bardem's playboy character. I'd probably have to say that the weakest performance in the film comes from Scarlett Johansson who plays Cristina, simply because her character doesn't have the same insight or is as dynamic, or as interesting as the other characters. Not to say that she weighs the film down, or anything like that, no not at all, but compared to the others it just really is not a standout performance, but because of the way her character is written, she is not given as much to work with and she is not as interesting a character as say Rebecca Hall's Vicky, or anything like that. Still that would be my only mild complaint about the film, but because of how the film plays out, one weak performance can not stop a movie with otherwise great acting and writing from being a great film. Listening to these characters talk was a very enjoyable experience if you are a fan of good writing and with the interesting dissection of these characters and these honest looks at their love lives I would say it is all done very well. This is also a beautiful looking film and is a lot to take in and think about. Even though I would not call this film a comedy I would say it works perfect as a drama and because of all the mastered writing and acting that went into it, I would say it's one of this year's finest accomplishments and one of the best films of the year so far."
"M2b","10","7","17","19 August 2008"," The Woodman hits a home run, finally (some mild spoilers)
","Perhaps the oldest working director in films (at least that would seem to be so for a successful stand-up comic WHO STARTED IN THE FIFTIES!) has turned out a beaut. Woody Allen has penned an adult romantic comedy with ten times the laughs (at least for me) of Pineapple Express. Called ""Vicky And Christina Spend the Summer in Barcelona"".<br/><br/>The star of the film is none other than the cold killer from No Country For Old Men, Oscar winner Javier Bardem proving his acting range goes way beyond scaring the s-word out of people. He plays a full of life, passionate Spanish painter-lover, and bless him for this. He nails a fine-wine getting hotter as she gets older Penelope Cruz, an equally desirable please-let-me-have-this Scarlett Johansen and a prissy uptight academic Rebecca Hall, who none of you ever heard of before (admit it). Sometimes more than one of them at the same time.<br/><br/>The acting is flawless. That's why Penelope and Scarlett stand out from other cinema hotties....they can act, they both have their craft down perfectly. Sadly, none of them go nude in the flick, but guys, there is a scene between Penny and Scarlett that will make you want to stand up and cheer anyway. YAHOOOOOO !!!<br/><br/>Woody's script shows two particular brilliancies, that seems to evade the rest of the hacks of Hollywood. He likes to insert his own film personnae into his films, and this time it's the Rebecca Hall character who does the Woodman's comedic pseudo-intellectual schtick. Really smart to switch himself to the woman, cause when he's used younger actors as himself, it becomes imitative parody and fails. And Woody himself it just too old for any make-up genius to make you think he is only 60, an age he passed a long long time ago. Rebecca is remarkable, holding her own against the two stellar screen beauties...and making her far less than super looks come out as still highly desirable.....in controlled passion coming out of it's containment at last.<br/><br/>Secondly, Woody brilliantly uses a narrator to make his cinematic novel come alive. The dialogue you would read in a novel comes to life in the faces of this great crew of actors. And instead of adding 30+ minutes of extraneous films to set the scene, or making stupid dialogue just so the audience can be informed of the plot, a simple line or two or concise narration keeps the film moving at a perfect pace. And Woody uses a young actor, not his old self for the narrator, which would have detracted from the youth and exuberance of the film.<br/><br/>Also, the musical score and the cinematography are great, simply great. Good job old guy. I loved the film. You made us old guys proud. And err, next time could you let us see Johannsen's goods. I KNOW she's shown you, you can't lie to M2b. So share."
"socrates99","9","4","8","9 February 2009"," Didn't think I'd see this Woody Allen take on Latin loveplay
","Didn't think he was capable of portraying it honestly or with any insight. Surely Barcelona is a long ways from angst-ridden Manhatten. And though I like Bardem's work, and think Scarlett Johansson is always a great choice for female lead, I was leery about spending much time watching Penelope Cruz acting wild and over-the-top at Allen's direction. To my surprise, Cruz was the most impressive of all. In just a few minutes, and she's on only a short time, she manages to nail a certain Latin type that anyone acquainted with the genuine article will recognize immediately. My only complaint is I wish Allen had gotten his camera in a little closer to Cruz as her performance is truly memorable and I would have enjoyed seeing more of her. Otherwise, this is a fun sex comedy which I still have trouble attributing to Woody Allen."
"jordan2240","4","6","14","7 March 2009"," Vicky Christina BOREcelona
","The movie's been over for about 10 minutes now, and I'm STILL waiting for something to happen. Honestly, I wanted to turn it off and go to bed before Penelope Cruz's character even showed up, but given she won an academy award for the part, I thought I'd stick it out. Well, she played her part fine, but it wasn't worth the wait. I suppose my expectation that a Woody Allen movie be at least remotely funny affects my opinion of anything he does, and this film provoked nary a snicker much less a laugh. I also think ol' Woody has quite a few fantasies about Ms. Johansson (sp?), based on her roles in his recent films. The narration of this film also was very annoying to me, both in dialog and the chosen voice. I think it would have been less so if Woody had done the narration himself.<br/><br/>Anyway, if you're a fan of old Woody Allen, this one isn't going to win you back. Frankly, I don't know who this film would appeal to at all - perhaps women who hate their marriages and get a daily dose of romance novels."
"Smells_Like_Cheese","8","6","14","24 August 2008"," Woody is back and makes an enjoyable movie!
","At my movie theater that I work at for some odd reason we got Vicky Cristina Barcelona 2 weeks after it's release, strange, but I don't know how these things work. But people were walking out very pleased with the movie. So I decided to go ahead and check it out, so I watched it this afternoon. Now we all have to admit, Woody has just been out of his game these past few decades, not since Annie Hall has he had a very memorable film. Nor have none of them have that creative edge that Woody has, but he still has something because Vicky Cristina Barcelona is a good movie. It has a strong story and was very different than any film we have had this year. We have a narrator throughout the film that just tells us the story as if he was reading a book. We have a strong cast that they can all hold their own on scree: Scarlett Johansson, Javier Bardem, and Penelope Cruz. They hold a strong chemistry and make the story very interesting.<br/><br/>Vicky and Cristina are best friends who are going to Barcelona for the summer, Vicky is a believer of realistic love and is engaged to a successful man who can make her ideal marriage dream work. Cristina is the idealist of a romantic love and meets a Spanish handsome charmer, Juan Antonio who invites the girls to another city for a weekend. He gets Cristina's notice automatically, but Vicky takes some seducing to get into bed. But Juan's crazy ex wife gets back into his life and just makes things very interesting for Cristina. Vicky starts to question her ideals on love when she is just swept off her feet with Juan.<br/><br/>Vicky Cristina Barcelona is a very well told story and nothing like I've seen before. Even though I found it to be unrealistic at times, this movie was just different, which we all need and Woody has a talent for showing that, as he has shown us with his private life, lol. But the acting is good and there are some funny moments and some touching one's as well. I loved how crazy Penelope was in this movie, she was like Fatal Attraction scary, yet you could see how Javier's character fell for her so hard, I don't blame him, I found her craziness attractive as well. So I do recommend this movie if you have the opportunity to see it, the characters are cool and the story is wonderful, Woody is back and throws in one last punch in the fight for his career.<br/><br/>8/10"
